post_id,comment_id,parent_id,level,level_path,type,title,body,author,score,upvote_ratio,num_comments,created_utc,url,permalink,is_original_content,is_self,over_18,spoiler,stickied,dataset,combined_text,created_datetime,emotion_label,emotion_name,emotion_confidence,prob_sadness,prob_joy,prob_love,prob_anger,prob_fear,prob_surprise,sentiment
107ya3v,107ya3v,,0,0,post,r/philippineairlines Lounge,A place for members of r/philippineairlines to chat with each other,Charming_Ad_2718,1,1.0,1,2023-01-10 10:43:58,https://www.reddit.com/r/philippineairlines/comments/107ya3v/rphilippineairlines_lounge/,/r/philippineairlines/comments/107ya3v/rphilippineairlines_lounge/,False,True,False,False,True,Philippine Airlines,r/philippineairlines Lounge A place for members of r/philippineairlines to chat with each other,2023-01-10 10:43:58,1,joy,0.9982493009884064,5.892516076180056e-13,0.9982493009884064,1.0186610377243361e-10,0.0017506684386720658,3.0308924342682855e-08,1.61541898270575e-10,positive
1oz9gqe,1oz9gqe,,0,0,post,Booking for baby,Pwede po kayang magbook ng flight pero wala pang passport yung baby? Ilalagay ko lang yung name ng baby. Waiting pa kami sa passport application ng baby ko. Pero need ko na ibook yun.,Loud-Evidence-5723,0,0.5,1,2025-11-17 14:49:11,https://www.reddit.com/r/philippineairlines/comments/1oz9gqe/booking_for_baby/,/r/philippineairlines/comments/1oz9gqe/booking_for_baby/,False,True,False,False,False,Philippine Airlines,Booking for baby Pwede po kayang magbook ng flight pero wala pang passport yung baby? Ilalagay ko lang yung name ng baby. Waiting pa kami sa passport application ng baby ko. Pero need ko na ibook yun.,2025-11-17 14:49:11,1,joy,0.9956916713566307,5.08311673620307e-08,0.9956916713566307,8.657091287888481e-05,0.003864215067607818,0.0003574917322177709,9.949758413635363e-11,positive
1oz9gqe,npc5ik7,1oz9gqe,1,0.0,comment,,Yes pwede na.,sleepinggolden,1,,0,2025-11-18 00:18:25,https://reddit.com/r/philippineairlines/comments/1oz9gqe/booking_for_baby/npc5ik7/,/r/philippineairlines/comments/1oz9gqe/booking_for_baby/npc5ik7/,,,False,False,False,Philippine Airlines,Yes pwede na.,2025-11-18 00:18:25,1,joy,0.9196263072859755,0.005096520258228973,0.9196263072859755,1.2703729829206838e-05,0.07522234937559093,6.474537950510398e-06,3.564481242471154e-05,positive
1oyemsk,1oyemsk,,0,0,post,PAL App,Have you ever booked a flight using the Philippine Airlines app?,Educational-Past6507,15,0.95,8,2025-11-16 14:34:40,https://i.redd.it/a4ej1hfidk1g1.jpeg,/r/philippineairlines/comments/1oyemsk/pal_app/,False,False,False,False,False,Philippine Airlines,PAL App Have you ever booked a flight using the Philippine Airlines app?,2025-11-16 14:34:40,1,joy,0.9999837926415998,5.133942765377927e-13,0.9999837926415998,9.272148071198921e-07,7.972604095152918e-11,1.5280063352972275e-05,7.713350872818762e-16,positive
1oyemsk,np5uq13,1oyemsk,1,0.0,comment,,"Yep, works well. Although I mainly use it nowadays for online check-in.",subliminalapple,3,,1,2025-11-17 00:04:40,https://reddit.com/r/philippineairlines/comments/1oyemsk/pal_app/np5uq13/,/r/philippineairlines/comments/1oyemsk/pal_app/np5uq13/,,,False,False,False,Philippine Airlines,"Yep, works well. Although I mainly use it nowadays for online check-in.",2025-11-17 00:04:40,1,joy,0.9999950502982141,1.2342308234632613e-10,0.9999950502982141,1.776765534082548e-06,1.4912780415703328e-08,3.156361452882257e-06,1.5385953307002532e-09,positive
1oyemsk,np99fl3,np5uq13,2,0.0.0,comment,,"Doesn’t really work well. It logs you out often, sometimes randomly while you’re searching. It’s really buggy when trying to book with miles. You can only store the details of 1 person. Unlike just about every airline company I have used, you can book using miles for multiple people. For PAL you can only book for yourself with miles, anyone else you have to call. It’s okay to book through online but I’d just use the web browser for that since the app is web based for that except with miles. It has a really long way to go before I’d even consider it decent and average compared to the international competition. Edit: Back because I was trying to check miles booking on the app and it just closes the app after I do face id sign in.",Professor_seX,1,,0,2025-11-17 11:07:20,https://reddit.com/r/philippineairlines/comments/1oyemsk/pal_app/np99fl3/,/r/philippineairlines/comments/1oyemsk/pal_app/np99fl3/,,,False,False,False,Philippine Airlines,"Doesn’t really work well. It logs you out often, sometimes randomly while you’re searching. It’s really buggy when trying to book with miles. You can only store the details of 1 person. Unlike just about every airline company I have used, you can book using miles for multiple people. For PAL you can only book for yourself with miles, anyone else you have to call. It’s okay to book through online but I’d just use the web browser for that since the app is web based for that except with miles. It has a really long way to go before I’d even consider it decent and average compared to the international competition. Edit: Back because I was trying to check miles booking on the app and it just closes the app after I do face id sign in.",2025-11-17 11:07:20,1,joy,0.9997038227081922,7.924425544008395e-09,0.9997038227081922,5.982278207223504e-07,8.75535927341384e-06,0.0002868157802387432,4.9427929232619926e-14,positive
1oyemsk,np4r1r5,1oyemsk,1,0.1,comment,,"Yes, last year.",__gemini_gemini08,2,,1,2025-11-16 19:42:53,https://reddit.com/r/philippineairlines/comments/1oyemsk/pal_app/np4r1r5/,/r/philippineairlines/comments/1oyemsk/pal_app/np4r1r5/,,,False,False,False,Philippine Airlines,"Yes, last year.",2025-11-16 19:42:53,1,joy,0.9998476428210403,0.0001486607675119243,0.9998476428210403,1.7671865792924518e-06,9.96309273545982e-07,7.774662220156504e-12,9.329078202888257e-07,positive
1oyemsk,np5kpbs,np4r1r5,2,0.1.0,comment,,Thank you! 🙂,Educational-Past6507,1,,0,2025-11-16 23:10:44,https://reddit.com/r/philippineairlines/comments/1oyemsk/pal_app/np5kpbs/,/r/philippineairlines/comments/1oyemsk/pal_app/np5kpbs/,,,False,False,False,Philippine Airlines,Thank you! 🙂,2025-11-16 23:10:44,1,joy,0.9999985424702368,2.148438783859211e-20,0.9999985424702368,1.4575269645459591e-06,2.6121291174834784e-12,5.353451616024507e-19,1.8658520733713865e-13,positive
1oyemsk,np4yka0,1oyemsk,1,0.2,comment,,Yes. May down time nga lang pero okay naman.,Suck_Copy_1994,2,,1,2025-11-16 20:47:29,https://reddit.com/r/philippineairlines/comments/1oyemsk/pal_app/np4yka0/,/r/philippineairlines/comments/1oyemsk/pal_app/np4yka0/,,,False,False,False,Philippine Airlines,Yes. May down time nga lang pero okay naman.,2025-11-16 20:47:29,1,joy,0.9999979811124705,2.975841073738405e-10,0.9999979811124705,1.0115704778125162e-07,1.1062472529919145e-06,8.111853263102207e-07,3.184664356154139e-13,positive
1oyemsk,np5kq70,np4yka0,2,0.2.0,comment,,Thank you 😊,Educational-Past6507,1,,0,2025-11-16 23:10:52,https://reddit.com/r/philippineairlines/comments/1oyemsk/pal_app/np5kq70/,/r/philippineairlines/comments/1oyemsk/pal_app/np5kq70/,,,False,False,False,Philippine Airlines,Thank you 😊,2025-11-16 23:10:52,1,joy,0.9997145039414849,2.852548567488409e-18,0.9997145039414849,0.00028549404361353196,2.0129671125698894e-09,1.4747989905654144e-17,1.9345901922362466e-12,positive
1oyemsk,np6bbxu,1oyemsk,1,0.3,comment,,Web based yung app nila except sa Mabuhay Miles. So far okay naman siya. Ang dilemma ko lang di ma port in sa Apple Wallet si Mabuhay Miles number like other Airlines although domestic ticket can be ported in,Both-Gain-9875,2,,0,2025-11-17 01:31:25,https://reddit.com/r/philippineairlines/comments/1oyemsk/pal_app/np6bbxu/,/r/philippineairlines/comments/1oyemsk/pal_app/np6bbxu/,,,False,False,False,Philippine Airlines,Web based yung app nila except sa Mabuhay Miles. So far okay naman siya. Ang dilemma ko lang di ma port in sa Apple Wallet si Mabuhay Miles number like other Airlines although domestic ticket can be ported in,2025-11-17 01:31:25,1,joy,0.9972610891764634,3.7412303529475144e-07,0.9972610891764634,2.4113430818669572e-05,0.0003018143586902768,0.00241260890883313,2.15952085112083e-12,positive
1oyemsk,npa65k1,1oyemsk,1,0.4,comment,,Pang track ng mabuhay miles at check in🤣,nutberr77,0,,0,2025-11-17 15:24:22,https://reddit.com/r/philippineairlines/comments/1oyemsk/pal_app/npa65k1/,/r/philippineairlines/comments/1oyemsk/pal_app/npa65k1/,,,False,False,False,Philippine Airlines,Pang track ng mabuhay miles at check in🤣,2025-11-17 15:24:22,1,joy,0.9996393829229169,1.3728573357640302e-08,0.9996393829229169,2.585746206139773e-06,2.8724462136794206e-07,0.00035773035766565843,1.6615172305332527e-14,positive
1oyg8bb,1oyg8bb,,0,0,post,car parts,"Can you bring a car carburetor through check in/ handcarry? Brand new, has no fuel or liquid whatsoever.",JobNo9622,1,1.0,1,2025-11-16 16:13:26,https://www.reddit.com/r/philippineairlines/comments/1oyg8bb/car_parts/,/r/philippineairlines/comments/1oyg8bb/car_parts/,False,True,False,False,False,Philippine Airlines,"car parts Can you bring a car carburetor through check in/ handcarry? Brand new, has no fuel or liquid whatsoever.",2025-11-16 16:13:26,1,joy,0.999813897854182,1.7918068846690088e-08,0.999813897854182,3.0927795337086005e-09,0.00018508548653464125,2.7515882390571926e-07,7.2048961125535e-07,positive
1oyg8bb,npeoq0z,1oyg8bb,1,0.0,comment,,"It will depend on the airport if they accept such in your handcarry. Or if it's significantly heavy and you get past the 7kg limit, you might have to reconsider bringing that.",StellarBoy0629,1,,0,2025-11-18 08:04:27,https://reddit.com/r/philippineairlines/comments/1oyg8bb/car_parts/npeoq0z/,/r/philippineairlines/comments/1oyg8bb/car_parts/npeoq0z/,,,False,False,False,Philippine Airlines,"It will depend on the airport if they accept such in your handcarry. Or if it's significantly heavy and you get past the 7kg limit, you might have to reconsider bringing that.",2025-11-18 08:04:27,1,joy,0.9999868880949213,4.706752427219596e-06,0.9999868880949213,7.599534804362047e-09,1.160993715542241e-06,7.236549686474659e-06,9.714680484147743e-12,positive
1oxta97,1oxta97,,0,0,post,A321ceo Retrofit,"Has anyone tried the A321ceo Retrofit aircraft of Philippine Airlines? How are the seats, especially the bulkhead seats? What seats are the best in terms of comfort and leg room aside from the Business Class seats? Thank you.",RevvedUpRebel,2,1.0,0,2025-11-15 22:38:02,https://www.reddit.com/r/philippineairlines/comments/1oxta97/a321ceo_retrofit/,/r/philippineairlines/comments/1oxta97/a321ceo_retrofit/,False,True,False,False,False,Philippine Airlines,"A321ceo Retrofit Has anyone tried the A321ceo Retrofit aircraft of Philippine Airlines? How are the seats, especially the bulkhead seats? What seats are the best in terms of comfort and leg room aside from the Business Class seats? Thank you.",2025-11-15 22:38:02,1,joy,0.9999065758247963,1.207497817746576e-13,0.9999065758247963,1.1967681373003543e-06,9.22157788679256e-05,1.1270390100681704e-08,3.5768756974209373e-10,positive
1oxxf7h,1oxxf7h,,0,0,post,Is there a chance PAL cancel flight months prior to departure?,"We are a group of three that planned to travel Japan however one of us cancelled today due to conflict of sched at work. My other friend and I kind of wanted to cancel too because of the expenses we are to shoulder as dalawa nalang kami, yeah too bad… since dalawa nalang kami and honestly dahil na spoil na yung mood? My question - is there a chance na mag cancel / rebook / refund option si PAL given na seat sale namin nakuha ang tickets? And typically how many months/ days prior to departure? Our travel month is March next year, peak season na din. Just so we can accept if no chance na talaga magbago plans and proceed nalang… Thank you all!",UnderstandingKey4725,1,1.0,2,2025-11-16 01:24:24,https://www.reddit.com/r/philippineairlines/comments/1oxxf7h/is_there_a_chance_pal_cancel_flight_months_prior/,/r/philippineairlines/comments/1oxxf7h/is_there_a_chance_pal_cancel_flight_months_prior/,False,True,False,False,False,Philippine Airlines,"Is there a chance PAL cancel flight months prior to departure? We are a group of three that planned to travel Japan however one of us cancelled today due to conflict of sched at work. My other friend and I kind of wanted to cancel too because of the expenses we are to shoulder as dalawa nalang kami, yeah too bad… since dalawa nalang kami and honestly dahil na spoil na yung mood? My question - is there a chance na mag cancel / rebook / refund option si PAL given na seat sale namin nakuha ang tickets? And typically how many months/ days prior to departure? Our travel month is March next year, peak season na din. Just so we can accept if no chance na talaga magbago plans and proceed nalang… Thank you all!",2025-11-16 01:24:24,3,anger,0.6033154197252124,0.00037662469190511945,0.3882500832070971,1.3372303040460776e-05,0.6033154197252124,0.008044500065403871,7.341009424745079e-12,negative
1oxxf7h,np4nrjd,1oxxf7h,1,0.0,comment,,Most seat sale tickets are non refundable. They may refund you but just the taxes and not the whole fare.,Fantastic_One_3108,1,,0,2025-11-16 19:11:05,https://reddit.com/r/philippineairlines/comments/1oxxf7h/is_there_a_chance_pal_cancel_flight_months_prior/np4nrjd/,/r/philippineairlines/comments/1oxxf7h/is_there_a_chance_pal_cancel_flight_months_prior/np4nrjd/,,,False,False,False,Philippine Airlines,Most seat sale tickets are non refundable. They may refund you but just the taxes and not the whole fare.,2025-11-16 19:11:05,3,anger,0.8555791507689878,2.8764485490954504e-05,0.14438094351371666,7.237104225290182e-09,0.8555791507689878,1.1133994699906083e-05,4.579443960911109e-16,negative
1oxxf7h,np4s9u2,1oxxf7h,1,0.1,comment,,Shouldn't they apply leave on the said dates to address the conflict of schedule?,Super-Scheme-9803,1,,0,2025-11-16 19:54:00,https://reddit.com/r/philippineairlines/comments/1oxxf7h/is_there_a_chance_pal_cancel_flight_months_prior/np4s9u2/,/r/philippineairlines/comments/1oxxf7h/is_there_a_chance_pal_cancel_flight_months_prior/np4s9u2/,,,False,False,False,Philippine Airlines,Shouldn't they apply leave on the said dates to address the conflict of schedule?,2025-11-16 19:54:00,3,anger,0.8297345056738482,0.16071459508130473,0.009550421454888103,4.7577851479695747e-07,0.8297345056738482,1.6485415993335127e-09,3.629024868077561e-10,negative
1oxtyji,1oxtyji,,0,0,post,What’s the check-in baggage size for 10kg? (PAL Domestic),"Hi! I’m flying domestically with Philippine Airlines and my ticket includes a 10kg check-in baggage allowance. Does anyone know the allowed or recommended luggage size for 10kg? Is there a specific dimension limit, or is it okay as long as it doesn’t exceed the weight? Thanks in advance!",Accomplished-Set5657,1,1.0,0,2025-11-15 23:06:37,https://www.reddit.com/r/philippineairlines/comments/1oxtyji/whats_the_checkin_baggage_size_for_10kg_pal/,/r/philippineairlines/comments/1oxtyji/whats_the_checkin_baggage_size_for_10kg_pal/,False,True,False,False,False,Philippine Airlines,"What’s the check-in baggage size for 10kg? (PAL Domestic) Hi! I’m flying domestically with Philippine Airlines and my ticket includes a 10kg check-in baggage allowance. Does anyone know the allowed or recommended luggage size for 10kg? Is there a specific dimension limit, or is it okay as long as it doesn’t exceed the weight? Thanks in advance!",2025-11-15 23:06:37,4,fear,0.5800379963634732,2.1374182806262045e-07,0.41996114672616663,3.0977245657916006e-07,3.3339570112407373e-07,0.5800379963634732,3.744068143419314e-13,negative
1oxtrmg,1oxtrmg,,0,0,post,Manage Booking - Cannot update passport details,"Hi everyone, I’m hoping someone can help. I booked my flight through the Agoda app, and the booking is already confirmed—I can also access it through the PAL website. However, I understand that I still need to update some information, like my passport details, directly on the PAL website. The problem is that whenever I try to save my details, the site gives me an error saying: “Sorry, your advance passenger information is not saved.” I’ve already tried contacting PAL customer service, but I haven’t been able to get through. Has anyone experienced this issue, and is there a fix?",Alternative_Cup8815,1,1.0,2,2025-11-15 22:58:34,https://www.reddit.com/r/philippineairlines/comments/1oxtrmg/manage_booking_cannot_update_passport_details/,/r/philippineairlines/comments/1oxtrmg/manage_booking_cannot_update_passport_details/,False,True,False,False,False,Philippine Airlines,"Manage Booking - Cannot update passport details Hi everyone, I’m hoping someone can help. I booked my flight through the Agoda app, and the booking is already confirmed—I can also access it through the PAL website. However, I understand that I still need to update some information, like my passport details, directly on the PAL website. The problem is that whenever I try to save my details, the site gives me an error saying: “Sorry, your advance passenger information is not saved.” I’ve already tried contacting PAL customer service, but I haven’t been able to get through. Has anyone experienced this issue, and is there a fix?",2025-11-15 22:58:34,4,fear,0.9995890754041172,9.508054855518419e-11,0.0002459027966564665,5.42654734139879e-08,0.00016496743867222332,0.9995890754041172,1.6621606436645847e-18,negative
1oxtrmg,np5lkwz,1oxtrmg,1,0.0,comment,,have you tried their web chat?,PepperDaisy99,1,,0,2025-11-16 23:15:39,https://reddit.com/r/philippineairlines/comments/1oxtrmg/manage_booking_cannot_update_passport_details/np5lkwz/,/r/philippineairlines/comments/1oxtrmg/manage_booking_cannot_update_passport_details/np5lkwz/,,,False,False,False,Philippine Airlines,have you tried their web chat?,2025-11-16 23:15:39,3,anger,0.9998050441581164,9.37305260549651e-10,0.00013510314233581875,9.788505889169438e-10,0.9998050441581164,5.985078318227998e-05,2.0953178415157936e-13,negative
1oxtrmg,np9spbu,1oxtrmg,1,0.1,comment,,"I'm having same problem..Did you get it fixed, OP? If yes, how?",Mammoth_Educator_343,1,,0,2025-11-17 13:21:24,https://reddit.com/r/philippineairlines/comments/1oxtrmg/manage_booking_cannot_update_passport_details/np9spbu/,/r/philippineairlines/comments/1oxtrmg/manage_booking_cannot_update_passport_details/np9spbu/,,,False,False,False,Philippine Airlines,"I'm having same problem..Did you get it fixed, OP? If yes, how?",2025-11-17 13:21:24,1,joy,0.9671354040147164,7.98461891968109e-10,0.9671354040147164,1.4345298185499704e-06,0.0326555255783696,0.00020763507638888584,2.2447908883641698e-12,positive
1oxqh88,1oxqh88,,0,0,post,PAL International Checked Luggage,"Hi! I’m flying internationally with Philippine Airlines and I want to double-check my luggage size. My suitcase is American Tourister Hundo Spinner 52cm x 81cm x 35cm (4.7kg). Has anyone here tried checking in a similar size with PAL? Were they strict with measuring the dimensions, or did it pass without issues? I just want to know if this will likely be accepted or if I should expect oversize fees. Thanks!",science-noodles,1,0.67,0,2025-11-15 20:27:24,https://www.reddit.com/r/philippineairlines/comments/1oxqh88/pal_international_checked_luggage/,/r/philippineairlines/comments/1oxqh88/pal_international_checked_luggage/,False,True,False,False,False,Philippine Airlines,"PAL International Checked Luggage Hi! I’m flying internationally with Philippine Airlines and I want to double-check my luggage size. My suitcase is American Tourister Hundo Spinner 52cm x 81cm x 35cm (4.7kg). Has anyone here tried checking in a similar size with PAL? Were they strict with measuring the dimensions, or did it pass without issues? I just want to know if this will likely be accepted or if I should expect oversize fees. Thanks!",2025-11-15 20:27:24,1,joy,0.9979333230824852,3.603167811147268e-08,0.9979333230824852,9.924353381848043e-07,4.437829767989921e-05,0.0020212701434149756,9.403625570581136e-12,positive
1owwup4,1owwup4,,0,0,post,PAL carry on luggage size,"Hi! So I recently bought a Voyager Luggage as my carry on for my upcoming trip to Boracay, and I noticed that the dimensions are slightly bigger than the common carry on luggage size (56cm x 36cm x 23cm). I bought it at SM dept store, I repeatedly asked the sales person if it will fit in the overhead bin? They assured me that it is the standard size. I forgot to consider the dimensions of the luggage before buying. Here are the measurements that I took: L - 33cm W - 28cm H - 56cm w/ wheels, 52cm w/o wheels \*I think it is a ""trunk"" style luggage? And it is also expandable. I am quite anxious about this since it's my first luggage and it's also my first time travelling via plane. Do you think it will fit in PAL's overhead cabins? How about in other airlines? It's a week before my flight and I want to avoid paying additional charges as much as possible. Is it better if I just avail the additional baggage add on? Or should I just bet on my chances, and hope that they'll allow it at the check in counter? https://preview.redd.it/pn8gahf9881g1.jpg?width=1080&format=pjpg&auto=webp&s=22d446184c2c3ae54a08f4f8147a34363ce4d3cc",Green-Win1651,1,1.0,3,2025-11-14 21:43:59,https://www.reddit.com/r/philippineairlines/comments/1owwup4/pal_carry_on_luggage_size/,/r/philippineairlines/comments/1owwup4/pal_carry_on_luggage_size/,False,True,False,False,False,Philippine Airlines,"PAL carry on luggage size Hi! So I recently bought a Voyager Luggage as my carry on for my upcoming trip to Boracay, and I noticed that the dimensions are slightly bigger than the common carry on luggage size (56cm x 36cm x 23cm). I bought it at SM dept store, I repeatedly asked the sales person if it will fit in the overhead bin? They assured me that it is the standard size. I forgot to consider the dimensions of the luggage before buying. Here are the measurements that I took: L - 33cm W - 28cm H - 56cm w/ wheels, 52cm w/o wheels \*I think it is a ""trunk"" style luggage? And it is also expandable. I am quite anxious about this since it's my first luggage and it's also my first time travelling via plane. Do you think it will fit in PAL's overhead cabins? How about in other airlines? It's a week before my flight and I want to avoid paying additional charges as much as possible. Is it better if I just avail the additional baggage add on? Or should I just bet on my chances, and hope that they'll allow it at the check in counter? https://preview.redd.it/pn8gahf9881g1.jpg?width=1080&format=pjpg&auto=webp&s=22d446184c2c3ae54a08f4f8147a34363ce4d3cc",2025-11-14 21:43:59,4,fear,0.9988151965425359,2.6037505518832538e-08,0.0009022901277955369,6.758927672370088e-06,0.00027572041191943793,0.9988151965425359,7.952571292140761e-09,negative
1owwup4,novtsxg,1owwup4,1,0.0,comment,,I've never seen or heard an airline measuring a carry-on bag. That’s acceptable and will definitely fit the overhead bin.,__gemini_gemini08,2,,1,2025-11-15 06:13:51,https://reddit.com/r/philippineairlines/comments/1owwup4/pal_carry_on_luggage_size/novtsxg/,/r/philippineairlines/comments/1owwup4/pal_carry_on_luggage_size/novtsxg/,,,False,False,False,Philippine Airlines,I've never seen or heard an airline measuring a carry-on bag. That’s acceptable and will definitely fit the overhead bin.,2025-11-15 06:13:51,1,joy,0.9999999945293152,1.5537651858467495e-16,0.9999999945293152,9.851783325574366e-10,4.3943994950043954e-16,4.485505665457612e-09,1.956885587892345e-17,positive
1owwup4,noxqvxq,novtsxg,2,0.0.0,comment,,They do this all the time. [https://travel.stackexchange.com/questions/134957/how-seriously-should-i-take-size-and-weight-limits-of-hand-luggage](https://travel.stackexchange.com/questions/134957/how-seriously-should-i-take-size-and-weight-limits-of-hand-luggage),ogag79,1,,0,2025-11-15 13:52:29,https://reddit.com/r/philippineairlines/comments/1owwup4/pal_carry_on_luggage_size/noxqvxq/,/r/philippineairlines/comments/1owwup4/pal_carry_on_luggage_size/noxqvxq/,,,False,False,False,Philippine Airlines,They do this all the time. [https://travel.stackexchange.com/questions/134957/how-seriously-should-i-take-size-and-weight-limits-of-hand-luggage](https://travel.stackexchange.com/questions/134957/how-seriously-should-i-take-size-and-weight-limits-of-hand-luggage),2025-11-15 13:52:29,3,anger,0.9995841305945513,6.448522344098295e-07,0.00041304995929145093,1.3354321855340261e-07,0.9995841305945513,1.8403855242354114e-06,2.0066518025325056e-07,negative
1owwup4,now6f5v,1owwup4,1,0.1,comment,,"That’s okay. It can still fit the overhead bin. More than anything it’s the weight you should look out for. If it exceeds the max allowable limit for carry on, the staff will ask you to check it in.",Bulky-Meet3893,2,,0,2025-11-15 07:26:04,https://reddit.com/r/philippineairlines/comments/1owwup4/pal_carry_on_luggage_size/now6f5v/,/r/philippineairlines/comments/1owwup4/pal_carry_on_luggage_size/now6f5v/,,,False,False,False,Philippine Airlines,"That’s okay. It can still fit the overhead bin. More than anything it’s the weight you should look out for. If it exceeds the max allowable limit for carry on, the staff will ask you to check it in.",2025-11-15 07:26:04,1,joy,0.9958490247288315,9.387401512393296e-08,0.9958490247288315,3.602310520479768e-08,0.00017051695120053124,0.003980328383460397,3.9387391234570526e-11,positive
