post_id,comment_id,parent_id,level,level_path,type,title,body,author,score,upvote_ratio,num_comments,created_utc,url,permalink,is_original_content,is_self,over_18,spoiler,stickied,dataset,combined_text,created_datetime,emotion_label,emotion_name,emotion_confidence,prob_sadness,prob_joy,prob_love,prob_anger,prob_fear,prob_surprise,sentiment
1myzhh5,1myzhh5,,0,0,post,Need your thoughts po.,"Recently nag flight po kami from Manila to Melbourne thru PAL. We have 60kg free baggage allowance + 30kg prepaid baggage and oversize po ang 2 baggage namin by 6 inches each pero hindi overweight. They said na it should be computed as per volumetric LWH/305, which resulted po to 34.76kg. Based on my understanding po sa computation po ng volumentric kineme, per piece ng oversized baggage namin is 34.76 kahit na 30kg lang sya dahil oversized po, dalawa po ang oversize baggage namin at 1 regular size. meron po kami 60 na free baggage allowance at 30kg na prepaid baggage. Baggage 1 - 34.76 kg (30kg actual weight but due to oversize naging 34.76) Baggage 2 - 34.76 kg (30kg actual weight but due to oversize naging 34.76) Baggage 3 - 29 kg Total - 98.52 Ang free baggage allowance and prepaid po namin ay 90kg. 98.52kg minus 90kg po so ang excess po namin should only be 8.52 kg. And since per kg ang charge ng PAL.. 8.52 kg x 24usd = 204.48 usd Ang chinarge po sa amin ay $1632. Which is chinarge nila ang full bag as excess kahit may free baggage allowance and prepaid baggage. San po ba ito nacocomplain?",abcddcba-1234,1,1.0,4,2025-08-25 00:02:50,https://www.reddit.com/r/philippineairlines/comments/1myzhh5/need_your_thoughts_po/,/r/philippineairlines/comments/1myzhh5/need_your_thoughts_po/,False,True,False,False,False,Philippine Airlines,"Need your thoughts po. Recently nag flight po kami from Manila to Melbourne thru PAL. We have 60kg free baggage allowance + 30kg prepaid baggage and oversize po ang 2 baggage namin by 6 inches each pero hindi overweight. They said na it should be computed as per volumetric LWH/305, which resulted po to 34.76kg. Based on my understanding po sa computation po ng volumentric kineme, per piece ng oversized baggage namin is 34.76 kahit na 30kg lang sya dahil oversized po, dalawa po ang oversize baggage namin at 1 regular size. meron po kami 60 na free baggage allowance at 30kg na prepaid baggage. Baggage 1 - 34.76 kg (30kg actual weight but due to oversize naging 34.76) Baggage 2 - 34.76 kg (30kg actual weight but due to oversize naging 34.76) Baggage 3 - 29 kg Total - 98.52 Ang free baggage allowance and prepaid po namin ay 90kg. 98.52kg minus 90kg po so ang excess po namin should only be 8.52 kg. And since per kg ang charge ng PAL.. 8.52 kg x 24usd = 204.48 usd Ang chinarge po sa amin ay $1632. Which is chinarge nila ang full bag as excess kahit may free baggage allowance and prepaid baggage. San po ba ito nacocomplain?",2025-08-25 00:02:50,1,joy,0.45199720037021973,6.821610173264366e-05,0.45199720037021973,0.00019797755072089793,0.32562953227126135,0.2221070729138942,7.921712306661817e-10,positive
1myzhh5,najasad,1myzhh5,1,0.0,comment,,"Base on my understanding, ang free baggage allowance dapat pasok sa (1) weight and sa (2) size limitation as indicated sa website. If ang checked in bag ay within the weight limit pero oversized, it will still be charged as an excess baggage. With regards sa computation of the excess, I am not sure. You can raise the concern sa wecare@philippineairlines.com (or @pal.com.ph) not sure which domain ang gamit nila. You can try both",azyazy713,1,,1,2025-08-25 13:18:02,https://reddit.com/r/philippineairlines/comments/1myzhh5/need_your_thoughts_po/najasad/,/r/philippineairlines/comments/1myzhh5/need_your_thoughts_po/najasad/,,,False,False,False,Philippine Airlines,"Base on my understanding, ang free baggage allowance dapat pasok sa (1) weight and sa (2) size limitation as indicated sa website. If ang checked in bag ay within the weight limit pero oversized, it will still be charged as an excess baggage. With regards sa computation of the excess, I am not sure. You can raise the concern sa wecare@philippineairlines.com (or @pal.com.ph) not sure which domain ang gamit nila. You can try both",2025-08-25 13:18:02,4,fear,0.9824397337918103,4.084440044586682e-07,0.01524969142495643,1.678046519109431e-07,0.002309998534537106,0.9824397337918103,3.96639043448765e-14,negative
1myzhh5,najbivo,najasad,2,0.0.0,comment,,"Also, didn’t you asked during check in for clarification of the excess baggage charged to you?",azyazy713,1,,1,2025-08-25 13:24:42,https://reddit.com/r/philippineairlines/comments/1myzhh5/need_your_thoughts_po/najbivo/,/r/philippineairlines/comments/1myzhh5/need_your_thoughts_po/najbivo/,,,False,False,False,Philippine Airlines,"Also, didn’t you asked during check in for clarification of the excess baggage charged to you?",2025-08-25 13:24:42,4,fear,0.9994084567415155,1.1837162551442498e-05,0.00010472709178679622,6.491309000135589e-08,0.00047491405792578895,0.9994084567415155,3.3130573413729344e-11,negative
1myzhh5,najeu9w,najbivo,3,0.0.0.0,comment,,"we did ask po, pero pa iba iba ang amount na binibigay then nag end up sa $1632, mahaba na din po ang pila sa check in and ayaw kami issuehan ng boarding pass if hindi babayaran.",abcddcba-1234,1,,1,2025-08-25 13:55:58,https://reddit.com/r/philippineairlines/comments/1myzhh5/need_your_thoughts_po/najeu9w/,/r/philippineairlines/comments/1myzhh5/need_your_thoughts_po/najeu9w/,,,False,False,False,Philippine Airlines,"we did ask po, pero pa iba iba ang amount na binibigay then nag end up sa $1632, mahaba na din po ang pila sa check in and ayaw kami issuehan ng boarding pass if hindi babayaran.",2025-08-25 13:55:58,1,joy,0.9829133298048968,3.655508348766698e-08,0.9829133298048968,0.00023670771259260827,0.016269134765217935,0.0005807871390545626,4.0231548455192375e-09,positive
1myzhh5,najhzuv,najeu9w,4,0.0.0.0.0,comment,,Just keep the receipt that was issued to you and immediate email customer support and ask clarification on how excess baggage (oversize) should have been computed.,azyazy713,1,,0,2025-08-25 14:26:09,https://reddit.com/r/philippineairlines/comments/1myzhh5/need_your_thoughts_po/najhzuv/,/r/philippineairlines/comments/1myzhh5/need_your_thoughts_po/najhzuv/,,,False,False,False,Philippine Airlines,Just keep the receipt that was issued to you and immediate email customer support and ask clarification on how excess baggage (oversize) should have been computed.,2025-08-25 14:26:09,1,joy,0.9441024980567181,2.107954691465322e-09,0.9441024980567181,2.697692504248472e-08,0.014177157697288263,0.041720315161111514,2.285000514175378e-15,positive
1mru5wh,1mru5wh,,0,0,post,"flying to canada tomorrow, can i bring a disposable vape with me?","I'm 18, but my parents don't know I smoke. I'm planning to put my vape in my handbag (carryon), but a bit nervous that they'll take it out of my bag to inspect. I can't take out the battery and it's a disposable vape (looks like Geekbar). Anyone have any experience with security taking out disposable vapes? What did you guys do?",Anxious_Team1371,2,0.75,2,2025-08-16 20:41:59,https://www.reddit.com/r/philippineairlines/comments/1mru5wh/flying_to_canada_tomorrow_can_i_bring_a/,/r/philippineairlines/comments/1mru5wh/flying_to_canada_tomorrow_can_i_bring_a/,False,True,False,False,False,Philippine Airlines,"flying to canada tomorrow, can i bring a disposable vape with me? I'm 18, but my parents don't know I smoke. I'm planning to put my vape in my handbag (carryon), but a bit nervous that they'll take it out of my bag to inspect. I can't take out the battery and it's a disposable vape (looks like Geekbar). Anyone have any experience with security taking out disposable vapes? What did you guys do?",2025-08-16 20:41:59,4,fear,0.9999999993206172,7.33191289118029e-12,6.57327006168908e-10,2.76338775041301e-12,1.1960409799619767e-11,0.9999999993206172,7.093858625407211e-17,negative
1mru5wh,n914zhq,1mru5wh,1,0.0,comment,,You will have to take it out or they will open your carryon! Same with flying out from Manila! Don't bring it just buy it from a vape shop here.,One-Pepper-5018,1,,0,2025-08-17 00:28:12,https://reddit.com/r/philippineairlines/comments/1mru5wh/flying_to_canada_tomorrow_can_i_bring_a/n914zhq/,/r/philippineairlines/comments/1mru5wh/flying_to_canada_tomorrow_can_i_bring_a/n914zhq/,,,False,False,False,Philippine Airlines,You will have to take it out or they will open your carryon! Same with flying out from Manila! Don't bring it just buy it from a vape shop here.,2025-08-17 00:28:12,4,fear,0.5934065767958048,6.866750695002652e-06,0.40646250402075224,2.1479677440477186e-07,0.00012293023679484978,0.5934065767958048,9.073991787715265e-07,negative
1mru5wh,ngc85ok,1mru5wh,1,0.1,comment,,"Just keep it in your carry or personal item. It’s been working for me, same situation",nofairoceaneyes,1,,0,2025-09-27 01:19:31,https://reddit.com/r/philippineairlines/comments/1mru5wh/flying_to_canada_tomorrow_can_i_bring_a/ngc85ok/,/r/philippineairlines/comments/1mru5wh/flying_to_canada_tomorrow_can_i_bring_a/ngc85ok/,,,False,False,False,Philippine Airlines,"Just keep it in your carry or personal item. It’s been working for me, same situation",2025-09-27 01:19:31,1,joy,0.9999998855176182,6.312996896385389e-13,0.9999998855176182,3.65575226654399e-11,8.976899329329214e-08,2.4676109957873214e-08,8.988980020182479e-14,positive
1miow45,1miow45,,0,0,post,Change Flight Destination,"Hi, I want to ask if anyone here knows if it's possible to change my flight destination (domestic flight). I'm supposed to go to Davao but the destination might be changed to Cebu. Is it possible to change the destination from Davao to Cebu if I have already booked and paid for a ticket to Davao?",katalinax_x,1,1.0,1,2025-08-06 07:28:38,https://www.reddit.com/r/philippineairlines/comments/1miow45/change_flight_destination/,/r/philippineairlines/comments/1miow45/change_flight_destination/,False,True,False,False,False,Philippine Airlines,"Change Flight Destination Hi, I want to ask if anyone here knows if it's possible to change my flight destination (domestic flight). I'm supposed to go to Davao but the destination might be changed to Cebu. Is it possible to change the destination from Davao to Cebu if I have already booked and paid for a ticket to Davao?",2025-08-06 07:28:38,1,joy,0.9998316388046129,1.2531690328570517e-06,0.9998316388046129,7.008205408933585e-05,7.741270460324443e-05,1.961275253849066e-05,5.151230756233553e-10,positive
1miow45,n7y9rm9,1miow45,1,0.0,comment,,Nope. Not possible. Book new ticket. :),IDKWhyImHere416,1,,0,2025-08-10 23:13:56,https://reddit.com/r/philippineairlines/comments/1miow45/change_flight_destination/n7y9rm9/,/r/philippineairlines/comments/1miow45/change_flight_destination/n7y9rm9/,,,False,False,False,Philippine Airlines,Nope. Not possible. Book new ticket. :),2025-08-10 23:13:56,1,joy,0.9878635431608199,2.6895545946851703e-06,0.9878635431608199,0.00019144156702098774,0.0004110324770693096,0.011531262980660732,3.025983458130425e-08,positive
1mh1ft3,1mh1ft3,,0,0,post,"flying from ph to canada, are disposable vapes allowed on carry-on?","hi! ill be flying to canada next week, and was wondering if they'll ask to take out my disposable vape from my bag during security check. im 18 and legally allowed to vape, and there are no illegal/controlled substances in it. just a normal disposable vape. my parents dont know i vape yet, so im wondering if anyone has experienced security having to take it out during security? im planning on bringing 2 rechargeable ones with puff limits of 5600 and the other 15000.",Anxious_Team1371,1,1.0,0,2025-08-04 10:16:35,https://www.reddit.com/r/philippineairlines/comments/1mh1ft3/flying_from_ph_to_canada_are_disposable_vapes/,/r/philippineairlines/comments/1mh1ft3/flying_from_ph_to_canada_are_disposable_vapes/,False,True,False,False,False,Philippine Airlines,"flying from ph to canada, are disposable vapes allowed on carry-on? hi! ill be flying to canada next week, and was wondering if they'll ask to take out my disposable vape from my bag during security check. im 18 and legally allowed to vape, and there are no illegal/controlled substances in it. just a normal disposable vape. my parents dont know i vape yet, so im wondering if anyone has experienced security having to take it out during security? im planning on bringing 2 rechargeable ones with puff limits of 5600 and the other 15000.",2025-08-04 10:16:35,4,fear,0.9997610567776547,2.241135506558991e-09,0.00023892805334792768,8.398735469228118e-09,4.528651899052106e-09,0.9997610567776547,4.744666698286725e-13,negative
1md2ci8,1md2ci8,,0,0,post,Question on checked luggage allowance,my ticket includes 10 kg weight allowance. tapos bumili ako ng extra 20kg. can i bring one luggage up to 30kg? or kailangan 10kg and 20kg separately? medyo confused kasi it doesn’t specify sa baggage policy exactly. afaik pag weight concept pwede one or as many bags basta pasok sa total weight allowance. thanks sa makakasagot!,Reed_Wolfe,1,1.0,19,2025-07-30 17:49:51,https://i.redd.it/d2sxkyyygzff1.jpeg,/r/philippineairlines/comments/1md2ci8/question_on_checked_luggage_allowance/,False,False,False,False,False,Philippine Airlines,Question on checked luggage allowance my ticket includes 10 kg weight allowance. tapos bumili ako ng extra 20kg. can i bring one luggage up to 30kg? or kailangan 10kg and 20kg separately? medyo confused kasi it doesn’t specify sa baggage policy exactly. afaik pag weight concept pwede one or as many bags basta pasok sa total weight allowance. thanks sa makakasagot!,2025-07-30 17:49:51,4,fear,0.8969317413580536,3.741225971506413e-05,0.03082788025574545,1.3874389271761558e-05,0.07218909171606372,0.8969317413580536,2.115018429575677e-11,negative
1md2ci8,n5ypa4n,1md2ci8,1,0.0,comment,,"Luggage policy kasi can be weight concept or piece concept, depende sa airline. PAL is on piece concept. Their policy is 23 kg max and they are strict about it. So kung 30kg max mo- you can bring 2 bags but make sure weight of either bag will not exceed 23kg.",StrawberrySan16,1,,1,2025-07-30 19:58:26,https://reddit.com/r/philippineairlines/comments/1md2ci8/question_on_checked_luggage_allowance/n5ypa4n/,/r/philippineairlines/comments/1md2ci8/question_on_checked_luggage_allowance/n5ypa4n/,,,False,False,False,Philippine Airlines,"Luggage policy kasi can be weight concept or piece concept, depende sa airline. PAL is on piece concept. Their policy is 23 kg max and they are strict about it. So kung 30kg max mo- you can bring 2 bags but make sure weight of either bag will not exceed 23kg.",2025-07-30 19:58:26,3,anger,0.9999853750455756,1.5605843971486443e-07,1.446887799794914e-05,1.3010460735869689e-11,0.9999853750455756,4.976298853345026e-12,7.619064793800097e-17,negative
1md2ci8,n5ypujx,n5ypa4n,2,0.0.0,comment,,"hahaha im not sure anymore, i checked their website. ang nakalagay WEIGHT SYSTEM tapos not more than 32kg per piece. 🫤 https://www.philippineairlines.com/ph/en/before-you-fly/farerulesandconditions/philippines.html",Reed_Wolfe,1,,1,2025-07-30 20:02:02,https://reddit.com/r/philippineairlines/comments/1md2ci8/question_on_checked_luggage_allowance/n5ypujx/,/r/philippineairlines/comments/1md2ci8/question_on_checked_luggage_allowance/n5ypujx/,,,False,False,False,Philippine Airlines,"hahaha im not sure anymore, i checked their website. ang nakalagay WEIGHT SYSTEM tapos not more than 32kg per piece. 🫤 https://www.philippineairlines.com/ph/en/before-you-fly/farerulesandconditions/philippines.html",2025-07-30 20:02:02,1,joy,0.9999350624642313,3.5442699789452266e-10,0.9999350624642313,5.5274469393222376e-08,5.562617324820613e-09,6.48763439520985e-05,3.0302853376444103e-13,positive
1md2ci8,n5yrggh,n5ypujx,3,0.0.0.0,comment,,I just flew an intercontinental via Pal early this month. Sure ako na 23kg max per luggage.,StrawberrySan16,1,,1,2025-07-30 20:12:12,https://reddit.com/r/philippineairlines/comments/1md2ci8/question_on_checked_luggage_allowance/n5yrggh/,/r/philippineairlines/comments/1md2ci8/question_on_checked_luggage_allowance/n5yrggh/,,,False,False,False,Philippine Airlines,I just flew an intercontinental via Pal early this month. Sure ako na 23kg max per luggage.,2025-07-30 20:12:12,1,joy,0.999978453719105,1.9679354368952896e-07,0.999978453719105,8.840788414413792e-06,3.2870908369355792e-09,1.2471633122593536e-05,3.377872369881119e-08,positive
1md2ci8,n5ytbmc,n5yrggh,4,0.0.0.0.0,comment,,"maybe your ticket has a different baggage policy depending on your flight route. i contacted PAL’s support and they have confirmed that the combined baggage allowance of 30kg can be applied to just one bag, each bag should not weigh more than 32kg.",Reed_Wolfe,1,,1,2025-07-30 20:23:36,https://reddit.com/r/philippineairlines/comments/1md2ci8/question_on_checked_luggage_allowance/n5ytbmc/,/r/philippineairlines/comments/1md2ci8/question_on_checked_luggage_allowance/n5ytbmc/,,,False,False,False,Philippine Airlines,"maybe your ticket has a different baggage policy depending on your flight route. i contacted PAL’s support and they have confirmed that the combined baggage allowance of 30kg can be applied to just one bag, each bag should not weigh more than 32kg.",2025-07-30 20:23:36,1,joy,0.9994804531768575,6.346266591397449e-07,0.9994804531768575,8.11809231713753e-08,2.795705346467811e-06,0.0005160353100236298,1.896893242390611e-13,positive
1md2ci8,n5yw0vj,n5ytbmc,5,0.0.0.0.0.0,comment,,"Oki. 32 kg is universal safety standard. Pwede naman talaga 1 bag with 30kg. Double check with PAL if they will charge you extra for the 7kg. In my experience flying with them, up to 23 kg is free anything in excess will be charged extra.",StrawberrySan16,1,,1,2025-07-30 20:39:47,https://reddit.com/r/philippineairlines/comments/1md2ci8/question_on_checked_luggage_allowance/n5yw0vj/,/r/philippineairlines/comments/1md2ci8/question_on_checked_luggage_allowance/n5yw0vj/,,,False,False,False,Philippine Airlines,"Oki. 32 kg is universal safety standard. Pwede naman talaga 1 bag with 30kg. Double check with PAL if they will charge you extra for the 7kg. In my experience flying with them, up to 23 kg is free anything in excess will be charged extra.",2025-07-30 20:39:47,1,joy,0.9971216079863152,8.196134900425789e-08,0.9971216079863152,2.8639495631424646e-07,0.0028667173587924207,1.1306253114395927e-05,4.5472674319355065e-11,positive
1md2ci8,n5ywob1,n5yw0vj,6,0.0.0.0.0.0.0,comment,,thank you. they confirmed its okay. i paid for the extra 20kg so they shouldn’t charge me anything tbh.,Reed_Wolfe,1,,0,2025-07-30 20:43:35,https://reddit.com/r/philippineairlines/comments/1md2ci8/question_on_checked_luggage_allowance/n5ywob1/,/r/philippineairlines/comments/1md2ci8/question_on_checked_luggage_allowance/n5ywob1/,,,False,False,False,Philippine Airlines,thank you. they confirmed its okay. i paid for the extra 20kg so they shouldn’t charge me anything tbh.,2025-07-30 20:43:35,1,joy,0.9129636571151433,2.462206734119122e-07,0.9129636571151433,1.9600292753421364e-05,1.3910641192914489e-06,0.08701510530728813,2.2287366365182415e-14,positive
1md2ci8,n62e3ze,1md2ci8,1,0.1,comment,,I’m assuming this is a domestic flight? I’m 80% sure you can check in that 30kgs since fba mo now is at 30kgs.,azyazy713,1,,0,2025-07-31 06:51:30,https://reddit.com/r/philippineairlines/comments/1md2ci8/question_on_checked_luggage_allowance/n62e3ze/,/r/philippineairlines/comments/1md2ci8/question_on_checked_luggage_allowance/n62e3ze/,,,False,False,False,Philippine Airlines,I’m assuming this is a domestic flight? I’m 80% sure you can check in that 30kgs since fba mo now is at 30kgs.,2025-07-31 06:51:30,1,joy,0.9999999993236395,1.4429146881997976e-17,0.9999999993236395,9.260629927361523e-13,4.995635208996314e-15,6.754295646454552e-10,7.264741697969434e-18,positive
1md2ci8,ngsqhaf,1md2ci8,1,0.2,comment,,"Hello po, sorry noob question. I purchased economy super saver sa pal for a domestic flight, no checked baggage included. Then sa add on, I availed 10 kgs prepaid baggage. Is the 10 kgs I purchased for hand carry or for check in? Sa ticket po kasi nakalagay “No checked bag” tapos sa baba yung 10kgs prepaid baggage https://preview.redd.it/y1bll2c1k2sf1.jpeg?width=566&format=pjpg&auto=webp&s=58a82c2c34b090abe96d37139ab7b04ce67424c8",Deeb_Gee_1217,1,,2,2025-09-29 17:02:18,https://reddit.com/r/philippineairlines/comments/1md2ci8/question_on_checked_luggage_allowance/ngsqhaf/,/r/philippineairlines/comments/1md2ci8/question_on_checked_luggage_allowance/ngsqhaf/,,,False,False,False,Philippine Airlines,"Hello po, sorry noob question. I purchased economy super saver sa pal for a domestic flight, no checked baggage included. Then sa add on, I availed 10 kgs prepaid baggage. Is the 10 kgs I purchased for hand carry or for check in? Sa ticket po kasi nakalagay “No checked bag” tapos sa baba yung 10kgs prepaid baggage https://preview.redd.it/y1bll2c1k2sf1.jpeg?width=566&format=pjpg&auto=webp&s=58a82c2c34b090abe96d37139ab7b04ce67424c8",2025-09-29 17:02:18,4,fear,0.854128100291336,1.0394362480549117e-05,0.13514107973406653,0.0010040689353638702,0.009716323319757417,0.854128100291336,3.335699553654148e-08,negative
1md2ci8,ngsrugz,ngsqhaf,2,0.2.0,comment,,checked in bag po yan. hand carry is standard 7kg lang.,Reed_Wolfe,1,,0,2025-09-29 17:16:36,https://reddit.com/r/philippineairlines/comments/1md2ci8/question_on_checked_luggage_allowance/ngsrugz/,/r/philippineairlines/comments/1md2ci8/question_on_checked_luggage_allowance/ngsrugz/,,,False,False,False,Philippine Airlines,checked in bag po yan. hand carry is standard 7kg lang.,2025-09-29 17:16:36,1,joy,0.9463448711458226,1.3057117574809112e-06,0.9463448711458226,4.6469320958955904e-08,4.939842390863495e-08,0.05365372392538618,3.3492889471782063e-09,positive
1md2ci8,nkgj8xf,ngsqhaf,2,0.2.1,comment,,Hello same thing I did! Kamusta? Ung 10kg mo ba is checked in? May dala kasi ako luggage na less than 10kg for excess lang talaga nung hand carry ko na 7kg sana.,louiseconnected95,1,,1,2025-10-20 19:57:43,https://reddit.com/r/philippineairlines/comments/1md2ci8/question_on_checked_luggage_allowance/nkgj8xf/,/r/philippineairlines/comments/1md2ci8/question_on_checked_luggage_allowance/nkgj8xf/,,,False,False,False,Philippine Airlines,Hello same thing I did! Kamusta? Ung 10kg mo ba is checked in? May dala kasi ako luggage na less than 10kg for excess lang talaga nung hand carry ko na 7kg sana.,2025-10-20 19:57:43,1,joy,0.9967251851197557,7.560849168624398e-06,0.9967251851197557,5.12775065041705e-06,0.002094382887541012,0.001167743072349783,3.205342878610503e-10,positive
1md2ci8,nkqoh01,nkgj8xf,3,0.2.1.0,comment,,"Hi, wala pa po flight ko pero according dun sa naka usap from PAL CS via messenger, checked baggage dw po yung 10 kgs prepaid luggage",Deeb_Gee_1217,1,,0,2025-10-22 15:30:57,https://reddit.com/r/philippineairlines/comments/1md2ci8/question_on_checked_luggage_allowance/nkqoh01/,/r/philippineairlines/comments/1md2ci8/question_on_checked_luggage_allowance/nkqoh01/,,,False,False,False,Philippine Airlines,"Hi, wala pa po flight ko pero according dun sa naka usap from PAL CS via messenger, checked baggage dw po yung 10 kgs prepaid luggage",2025-10-22 15:30:57,4,fear,0.9594777838444111,1.2397356923940973e-05,0.04050938007769904,4.3399657526895425e-07,4.7243836034481e-09,0.9594777838444111,7.035878299618696e-15,negative
1md2ci8,n5y98zx,1md2ci8,1,0.3,comment,,[deleted],[deleted],0,,2,2025-07-30 17:53:36,https://reddit.com/r/philippineairlines/comments/1md2ci8/question_on_checked_luggage_allowance/n5y98zx/,/r/philippineairlines/comments/1md2ci8/question_on_checked_luggage_allowance/n5y98zx/,,,False,False,False,Philippine Airlines,[deleted],2025-07-30 17:53:36,1,joy,0.8153440533951897,0.1708243053196605,0.8153440533951897,1.1886068276856472e-05,0.0003263599261779916,1.856869151119812e-10,0.013493395105008105,positive
1md2ci8,n5y9lgm,n5y98zx,2,0.3.0,comment,,salamat! 23kg lang max? hindi ba 32kg?,Reed_Wolfe,1,,0,2025-07-30 17:56:45,https://reddit.com/r/philippineairlines/comments/1md2ci8/question_on_checked_luggage_allowance/n5y9lgm/,/r/philippineairlines/comments/1md2ci8/question_on_checked_luggage_allowance/n5y9lgm/,,,False,False,False,Philippine Airlines,salamat! 23kg lang max? hindi ba 32kg?,2025-07-30 17:56:45,1,joy,0.9996118875435794,0.0003417979775801483,0.9996118875435794,1.7910798683395942e-09,8.586852201220385e-08,4.622672685397851e-05,9.238464843208249e-11,positive
1md2ci8,n5y9ude,n5y98zx,2,0.3.1,comment,,"Not necessarily. You have to check the itinerary (doon sa PDF na sinesend sa email). May nakalagay doon kung ilang bags lang ang pwede mo dalhin, and what each bag should weigh at max Ang pwede lang i-combine, let's say you're traveling as a group of 4, if each of you are allowed to bring 2 bags at 23kg each, pwede niyo sabihin na i-total na lang yung baggage allowance para kung may mabigat na luggage, maoffset ng mas magaan",thecalvinreed,1,,1,2025-07-30 17:59:00,https://reddit.com/r/philippineairlines/comments/1md2ci8/question_on_checked_luggage_allowance/n5y9ude/,/r/philippineairlines/comments/1md2ci8/question_on_checked_luggage_allowance/n5y9ude/,,,False,False,False,Philippine Airlines,"Not necessarily. You have to check the itinerary (doon sa PDF na sinesend sa email). May nakalagay doon kung ilang bags lang ang pwede mo dalhin, and what each bag should weigh at max Ang pwede lang i-combine, let's say you're traveling as a group of 4, if each of you are allowed to bring 2 bags at 23kg each, pwede niyo sabihin na i-total na lang yung baggage allowance para kung may mabigat na luggage, maoffset ng mas magaan",2025-07-30 17:59:00,4,fear,0.9955166610948624,1.9941775537671318e-08,0.00445833765978741,7.389419769501811e-07,2.4242361449929533e-05,0.9955166610948624,1.4780054910295153e-13,negative
