post_id,comment_id,parent_id,level,level_path,type,title,body,author,score,upvote_ratio,num_comments,created_utc,url,permalink,is_original_content,is_self,over_18,spoiler,stickied,dataset,combined_text,created_datetime,emotion_label,emotion_name,emotion_confidence,prob_sadness,prob_joy,prob_love,prob_anger,prob_fear,prob_surprise,sentiment
1ia9od1,mdcxs6x,1ia9od1,1,0.1,comment,,"Good luck with this and if they're really giving you a hard time, try complaining to the DTI via their official portals (https://www.dti.gov.ph/konsyumer/complaints/). Haven't tried in airlines but definitely helped when more than one business took their time with refunds",PappyCucuy,1,,0,2025-02-18 09:59:46,https://reddit.com/r/philippineairlines/comments/1ia9od1/cancelled_without_compensation/mdcxs6x/,/r/philippineairlines/comments/1ia9od1/cancelled_without_compensation/mdcxs6x/,,,False,False,False,Philippine Airlines,"Good luck with this and if they're really giving you a hard time, try complaining to the DTI via their official portals (https://www.dti.gov.ph/konsyumer/complaints/). Haven't tried in airlines but definitely helped when more than one business took their time with refunds",2025-02-18 09:59:46,3,anger,0.9999999850247936,9.060107821232076e-09,5.912308376542005e-09,2.0478832628127956e-14,0.9999999850247936,2.61382111060435e-12,1.5586729420824304e-13,negative
1i3cvr4,1i3cvr4,,0,0,post,Service downgrade,"Our family has been loyal to Philippine Airlines for 12 years now. We have flown abroad using PAL most of the time, direct, since we are from the province. At least 3x a year as family and some domestic flight individually. We have noticed the decline of their services post-pandemic. I wonder if the management has done cost cutting. Just the past month, I have encountered 3 successive PAL-pak which is only expected on low budget airlines. 1. In our recent trip from abroad, we booked connecting flight because it was promised that check-thru will be a lot easier especially with several luggages for family trips. The PAL international flight arrived 1 hour late. And we have around 1 hour left to transfer to domestic airport. Instead of PAL staff to assist us, we were made to carry the checked in luggages by ourselves, got into the bus, and carried them down from the bus. It was very difficult because we had an elderly with us. Nobody volunteered to assist us from PAL. Also, instructions were confusing in NAIA as to transfer luggages when we arrived 2. While planning another trip, I called their hotline (mobile) to check our Mabuhay Miles. I was surprised that the agent could not quite articulate herself, ok lang sana magtagalog. Pero pilit pa nag English, self-conscious kaya nagkamali. Tapos she told me I used up my Miles on a particular date, when in fact, it was the booking date she found not the flight. I had to correct her pa indirectly. It is obvious that they have contracted out this service to a cheap agency. That was the worst CS I have experienced 3. Ticketing Office at the airport- We cannot purchase using Miles because services are down. We waited for 2 hours. And we were told it’s not the first time. Is this intentional so we will be forced to purchase regular ticket? Also, we loved the old staffs they used to have pre-pandemic days, very nice even to the elderly. Now, they are not as friendly.",Excellent_Design7237,2,1.0,3,2025-01-17 17:46:00,https://www.reddit.com/r/philippineairlines/comments/1i3cvr4/service_downgrade/,/r/philippineairlines/comments/1i3cvr4/service_downgrade/,False,True,False,False,False,Philippine Airlines,"Service downgrade Our family has been loyal to Philippine Airlines for 12 years now. We have flown abroad using PAL most of the time, direct, since we are from the province. At least 3x a year as family and some domestic flight individually. We have noticed the decline of their services post-pandemic. I wonder if the management has done cost cutting. Just the past month, I have encountered 3 successive PAL-pak which is only expected on low budget airlines. 1. In our recent trip from abroad, we booked connecting flight because it was promised that check-thru will be a lot easier especially with several luggages for family trips. The PAL international flight arrived 1 hour late. And we have around 1 hour left to transfer to domestic airport. Instead of PAL staff to assist us, we were made to carry the checked in luggages by ourselves, got into the bus, and carried them down from the bus. It was very difficult because we had an elderly with us. Nobody volunteered to assist us from PAL. Also, instructions were confusing in NAIA as to transfer luggages when we arrived 2. While planning another trip, I called their hotline (mobile) to check our Mabuhay Miles. I was surprised that the agent could not quite articulate herself, ok lang sana magtagalog. Pero pilit pa nag English, self-conscious kaya nagkamali. Tapos she told me I used up my Miles on a particular date, when in fact, it was the booking date she found not the flight. I had to correct her pa indirectly. It is obvious that they have contracted out this service to a cheap agency. That was the worst CS I have experienced 3. Ticketing Office at the airport- We cannot purchase using Miles because services are down. We waited for 2 hours. And we were told it’s not the first time. Is this intentional so we will be forced to purchase regular ticket? Also, we loved the old staffs they used to have pre-pandemic days, very nice even to the elderly. Now, they are not as friendly.",2025-01-17 17:46:00,2,love,0.996333792347563,2.7050729169842753e-12,0.003578116035460609,0.996333792347563,8.809068289466896e-05,1.0631256515219694e-15,9.313754390310906e-10,positive
1i3cvr4,m7mcn3c,1i3cvr4,1,0.0,comment,,"Find a new airline. I was attacked by another passenger on an international flight and PAL started out well enough, asking me to deplane first so I could deal with the police but then abandoned me before I left the plane. No help in deplaning even though passengers started to pull down bags from overhead compartments. No announcement to clear the aisle. No clear instructions on assisting me or handicapped brother. Ground agent assigned to help me claim bags from international flight abandoned me. Once I found my bags, no help in directions to police office at NAIA T1. Then PAL declined to press charges.",MotownMan646,2,,0,2025-01-17 20:56:18,https://reddit.com/r/philippineairlines/comments/1i3cvr4/service_downgrade/m7mcn3c/,/r/philippineairlines/comments/1i3cvr4/service_downgrade/m7mcn3c/,,,False,False,False,Philippine Airlines,"Find a new airline. I was attacked by another passenger on an international flight and PAL started out well enough, asking me to deplane first so I could deal with the police but then abandoned me before I left the plane. No help in deplaning even though passengers started to pull down bags from overhead compartments. No announcement to clear the aisle. No clear instructions on assisting me or handicapped brother. Ground agent assigned to help me claim bags from international flight abandoned me. Once I found my bags, no help in directions to police office at NAIA T1. Then PAL declined to press charges.",2025-01-17 20:56:18,4,fear,0.9995619572134858,6.544815659620069e-05,6.179176317933346e-08,1.100964928050165e-05,0.0003615231710781308,0.9995619572134858,1.779628679792065e-11,negative
1i3cvr4,m7zai6r,1i3cvr4,1,0.1,comment,,Surprised you put up with them that long. I’ve flown with them a total of 4 times and I will never fly with them again unless they are my only option.,iPoopandiDab,2,,0,2025-01-19 21:53:30,https://reddit.com/r/philippineairlines/comments/1i3cvr4/service_downgrade/m7zai6r/,/r/philippineairlines/comments/1i3cvr4/service_downgrade/m7zai6r/,,,False,False,False,Philippine Airlines,Surprised you put up with them that long. I’ve flown with them a total of 4 times and I will never fly with them again unless they are my only option.,2025-01-19 21:53:30,3,anger,0.7324030285724187,5.077945186563763e-07,0.0838187381193087,0.10135256147671347,0.7324030285724187,3.4532595395859636e-07,0.08242481871108649,negative
1i3cvr4,m8gvxzr,1i3cvr4,1,0.2,comment,,I just flew biz class Toronto to Bangkok via Manila and it was fantastic. The only problem I had was with my CPAP machine. The website said I needed to call before flight and I tried several times. Nobody knew how to handle this. Turns out nobody gave a shit anyway. Total waste of my time. The service and food both onboard and in the lounges was excellent. I’d fly again.,fuddledud,1,,0,2025-01-22 10:37:14,https://reddit.com/r/philippineairlines/comments/1i3cvr4/service_downgrade/m8gvxzr/,/r/philippineairlines/comments/1i3cvr4/service_downgrade/m8gvxzr/,,,False,False,False,Philippine Airlines,I just flew biz class Toronto to Bangkok via Manila and it was fantastic. The only problem I had was with my CPAP machine. The website said I needed to call before flight and I tried several times. Nobody knew how to handle this. Turns out nobody gave a shit anyway. Total waste of my time. The service and food both onboard and in the lounges was excellent. I’d fly again.,2025-01-22 10:37:14,1,joy,0.9999998833149212,5.586660680497745e-14,0.9999998833149212,5.797731643472194e-08,1.1769352481927142e-09,5.752835549036523e-08,2.415532725368288e-12,positive
1i396ji,1i396ji,,0,0,post,Request for Change of Title,"Hi any of you encountered making a mistake in choosing the title (MR,MS,MRS) upon booking? Context: we booked tickets last night and because nagkakaubusan na sa XL seats nagmamadali kame, apparently hindi ko nacheck yung passenger details ng isang kasama ko. I chose ""MR"" instead of ""MRS"". Fast forward to today, we called PAL to seek for assistance para to prevent problems during boarding. Surprisingly as per their manager we need to settle a charge of $20 for CHANGE OF NAME. Again we are requesting for change in TITLE and if we could also cross check the name booked vs ID's; wala namang MR,MRS,MS sa Governement identification.",everydayoptimism,2,1.0,9,2025-01-17 13:15:31,https://www.reddit.com/r/philippineairlines/comments/1i396ji/request_for_change_of_title/,/r/philippineairlines/comments/1i396ji/request_for_change_of_title/,False,True,False,False,False,Philippine Airlines,"Request for Change of Title Hi any of you encountered making a mistake in choosing the title (MR,MS,MRS) upon booking? Context: we booked tickets last night and because nagkakaubusan na sa XL seats nagmamadali kame, apparently hindi ko nacheck yung passenger details ng isang kasama ko. I chose ""MR"" instead of ""MRS"". Fast forward to today, we called PAL to seek for assistance para to prevent problems during boarding. Surprisingly as per their manager we need to settle a charge of $20 for CHANGE OF NAME. Again we are requesting for change in TITLE and if we could also cross check the name booked vs ID's; wala namang MR,MRS,MS sa Governement identification.",2025-01-17 13:15:31,4,fear,0.9549493893099767,4.5096672077979037e-07,0.04270059354984726,1.719817576736773e-06,0.0023478463525618645,0.9549493893099767,3.3166197645926162e-12,negative
1i396ji,m7l2kh1,1i396ji,1,0.0,comment,,"To support this post, we indicated FEMALE for the gender which is also the same with the ID",everydayoptimism,1,,0,2025-01-17 13:35:20,https://reddit.com/r/philippineairlines/comments/1i396ji/request_for_change_of_title/m7l2kh1/,/r/philippineairlines/comments/1i396ji/request_for_change_of_title/m7l2kh1/,,,False,False,False,Philippine Airlines,"To support this post, we indicated FEMALE for the gender which is also the same with the ID",2025-01-17 13:35:20,1,joy,0.9999979735134205,1.96835452502373e-06,0.9999979735134205,1.6073445453301307e-09,5.6392381096424906e-08,8.258399283085229e-15,1.3232053749912836e-10,positive
1i396ji,n9nxvo7,1i396ji,1,0.1,comment,,I'm experiencing this now. Huhu. Nagpachange po ba kayo or hindi na? tinanggap po ba kayo sa airport?,TurbulentGene2997,1,,1,2025-08-20 13:43:57,https://reddit.com/r/philippineairlines/comments/1i396ji/request_for_change_of_title/n9nxvo7/,/r/philippineairlines/comments/1i396ji/request_for_change_of_title/n9nxvo7/,,,False,False,False,Philippine Airlines,I'm experiencing this now. Huhu. Nagpachange po ba kayo or hindi na? tinanggap po ba kayo sa airport?,2025-08-20 13:43:57,1,joy,0.9999840284156046,1.3783101919746875e-08,0.9999840284156046,1.185006881906018e-07,1.1173922653324381e-05,4.665374240841599e-06,3.711065396444351e-12,positive
1i396ji,n9o4t8n,n9nxvo7,2,0.1.0,comment,,"Nope hindi na kame nagpachange, basta imporante same daw Full name Birthday",everydayoptimism,2,,2,2025-08-20 14:48:00,https://reddit.com/r/philippineairlines/comments/1i396ji/request_for_change_of_title/n9o4t8n/,/r/philippineairlines/comments/1i396ji/request_for_change_of_title/n9o4t8n/,,,False,False,False,Philippine Airlines,"Nope hindi na kame nagpachange, basta imporante same daw Full name Birthday",2025-08-20 14:48:00,0,sadness,0.7916917962443818,0.7916917962443818,0.20729432771093714,5.392240120789927e-08,0.0010054849202447565,8.337201513057116e-06,5.218653374761406e-13,negative
1i396ji,nak1q4a,n9o4t8n,3,0.1.0.0,comment,,[deleted],[deleted],1,,1,2025-08-25 17:43:53,https://reddit.com/r/philippineairlines/comments/1i396ji/request_for_change_of_title/nak1q4a/,/r/philippineairlines/comments/1i396ji/request_for_change_of_title/nak1q4a/,,,False,False,False,Philippine Airlines,[deleted],2025-08-25 17:43:53,1,joy,0.8153440533951897,0.1708243053196605,0.8153440533951897,1.1886068276856472e-05,0.0003263599261779916,1.856869151119812e-10,0.013493395105008105,positive
1i396ji,nlz1cnx,nak1q4a,4,0.1.0.0.0,comment,,Kamusta po. Naka travel?,jrve245,1,,0,2025-10-29 16:07:07,https://reddit.com/r/philippineairlines/comments/1i396ji/request_for_change_of_title/nlz1cnx/,/r/philippineairlines/comments/1i396ji/request_for_change_of_title/nlz1cnx/,,,False,False,False,Philippine Airlines,Kamusta po. Naka travel?,2025-10-29 16:07:07,4,fear,0.8162908379490174,1.7328520856190323e-06,0.18359651334020674,6.778906925193705e-07,0.00011023796688364011,0.8162908379490174,1.1142260986614378e-12,negative
1i396ji,ndo00l3,n9o4t8n,3,0.1.0.1,comment,,Hi! Currently experiencing this. No problems naman po ba during your flight?,Kitchen_Ad1992,1,,2,2025-09-12 01:10:07,https://reddit.com/r/philippineairlines/comments/1i396ji/request_for_change_of_title/ndo00l3/,/r/philippineairlines/comments/1i396ji/request_for_change_of_title/ndo00l3/,,,False,False,False,Philippine Airlines,Hi! Currently experiencing this. No problems naman po ba during your flight?,2025-09-12 01:10:07,4,fear,0.961176585926552,0.002745588799751606,0.034513203321726145,3.314660776955388e-07,0.0015642904144234327,0.961176585926552,7.146916362897103e-11,negative
1i396ji,ndo4atz,ndo00l3,4,0.1.0.1.0,comment,,Nope. Walang naging problem. Its just their legal way of scamming lol,everydayoptimism,1,,0,2025-09-12 01:30:02,https://reddit.com/r/philippineairlines/comments/1i396ji/request_for_change_of_title/ndo4atz/,/r/philippineairlines/comments/1i396ji/request_for_change_of_title/ndo4atz/,,,False,False,False,Philippine Airlines,Nope. Walang naging problem. Its just their legal way of scamming lol,2025-09-12 01:30:02,4,fear,0.5858522020823896,5.024909105338357e-05,0.40609388034864385,5.946320146302808e-09,0.008003662516851612,0.5858522020823896,1.4741390521488896e-11,negative
1i396ji,nlz1cem,ndo00l3,4,0.1.0.1.1,comment,,Kamusta po. Naka travel?,jrve245,1,,0,2025-10-29 16:07:03,https://reddit.com/r/philippineairlines/comments/1i396ji/request_for_change_of_title/nlz1cem/,/r/philippineairlines/comments/1i396ji/request_for_change_of_title/nlz1cem/,,,False,False,False,Philippine Airlines,Kamusta po. Naka travel?,2025-10-29 16:07:03,4,fear,0.8162908379490174,1.7328520856190323e-06,0.18359651334020674,6.778906925193705e-07,0.00011023796688364011,0.8162908379490174,1.1142260986614378e-12,negative
1i396ji,nhjebsx,1i396ji,1,0.2,comment,,Naka travel parin po ba kahit wrong ang name title ?,Frosty-Hamster6498,1,,1,2025-10-03 20:57:36,https://reddit.com/r/philippineairlines/comments/1i396ji/request_for_change_of_title/nhjebsx/,/r/philippineairlines/comments/1i396ji/request_for_change_of_title/nhjebsx/,,,False,False,False,Philippine Airlines,Naka travel parin po ba kahit wrong ang name title ?,2025-10-03 20:57:36,3,anger,0.9999939100489482,1.5068381319703284e-06,2.7842956805291908e-06,7.212036432684158e-08,0.9999939100489482,1.7266968746969737e-06,4.767967113102011e-16,negative
1i396ji,nlz1dbz,nhjebsx,2,0.2.0,comment,,Any updates po here?,jrve245,1,,0,2025-10-29 16:07:19,https://reddit.com/r/philippineairlines/comments/1i396ji/request_for_change_of_title/nlz1dbz/,/r/philippineairlines/comments/1i396ji/request_for_change_of_title/nlz1dbz/,,,False,False,False,Philippine Airlines,Any updates po here?,2025-10-29 16:07:19,1,joy,0.9999984648296885,3.5722917824993468e-12,0.9999984648296885,2.658782003159548e-09,1.5322092562539886e-06,2.9823091093704006e-10,4.700246022065661e-13,positive
1i2gq1d,1i2gq1d,,0,0,post,Carry on bag size - Away Luggage,"Has anyone tried to take the Away Larger Carry on bag (non expandable) on PAL? It’s a flight from the US to Manila, so I hope it fits, but it appears like it might be slight oversized. Can’t tell if I’ll have to pay a fee or if I will have to check it.",larlar_17,1,1.0,4,2025-01-16 12:17:22,https://www.reddit.com/r/philippineairlines/comments/1i2gq1d/carry_on_bag_size_away_luggage/,/r/philippineairlines/comments/1i2gq1d/carry_on_bag_size_away_luggage/,False,True,False,False,False,Philippine Airlines,"Carry on bag size - Away Luggage Has anyone tried to take the Away Larger Carry on bag (non expandable) on PAL? It’s a flight from the US to Manila, so I hope it fits, but it appears like it might be slight oversized. Can’t tell if I’ll have to pay a fee or if I will have to check it.",2025-01-16 12:17:22,1,joy,0.885474132601005,6.387497226997957e-05,0.885474132601005,1.247140555616749e-07,0.00138396816609552,0.11307789923659557,3.0997847995078927e-10,positive
1i2gq1d,m7egt75,1i2gq1d,1,0.0,comment,,"Yes, it’ll be fine to take. I had to put in lengthwise in the middle overhead bins but it fit fine inside the side overhead bins (does that make sense?). No fee was charged and I didn’t have to check it in. I just traveled back January 4th.",canmynamebethis01,1,,1,2025-01-16 12:43:48,https://reddit.com/r/philippineairlines/comments/1i2gq1d/carry_on_bag_size_away_luggage/m7egt75/,/r/philippineairlines/comments/1i2gq1d/carry_on_bag_size_away_luggage/m7egt75/,,,False,False,False,Philippine Airlines,"Yes, it’ll be fine to take. I had to put in lengthwise in the middle overhead bins but it fit fine inside the side overhead bins (does that make sense?). No fee was charged and I didn’t have to check it in. I just traveled back January 4th.",2025-01-16 12:43:48,1,joy,0.9924802131308963,5.203276263811152e-11,0.9924802131308963,3.8141567536054666e-10,4.59673717813356e-09,0.007519781838426969,4.911550967304469e-13,positive
1i2gq1d,m7ehcin,m7egt75,2,0.0.0,comment,,That makes sense! Thank you for the help. I’m assuming it’s also fine for the domestic flights but that won’t be as bad to check it for a quick flight if I need to. Appreciate the help!,larlar_17,1,,0,2025-01-16 12:47:47,https://reddit.com/r/philippineairlines/comments/1i2gq1d/carry_on_bag_size_away_luggage/m7ehcin/,/r/philippineairlines/comments/1i2gq1d/carry_on_bag_size_away_luggage/m7ehcin/,,,False,False,False,Philippine Airlines,That makes sense! Thank you for the help. I’m assuming it’s also fine for the domestic flights but that won’t be as bad to check it for a quick flight if I need to. Appreciate the help!,2025-01-16 12:47:47,1,joy,0.9999999999358233,1.118695638574354e-20,0.9999999999358233,2.594739280740246e-11,2.302762685867686e-13,3.799883371851274e-11,1.8903449174785136e-18,positive
1i2gq1d,m7ew8bh,1i2gq1d,1,0.1,comment,,"Yes, I had connecting domestic flight and it fit fine as well.",canmynamebethis01,1,,1,2025-01-16 14:52:08,https://reddit.com/r/philippineairlines/comments/1i2gq1d/carry_on_bag_size_away_luggage/m7ew8bh/,/r/philippineairlines/comments/1i2gq1d/carry_on_bag_size_away_luggage/m7ew8bh/,,,False,False,False,Philippine Airlines,"Yes, I had connecting domestic flight and it fit fine as well.",2025-01-16 14:52:08,1,joy,0.999999999908372,2.1031407127742595e-16,0.999999999908372,8.264198966847562e-11,3.2777576928664836e-16,8.98574683373117e-12,1.083954331896563e-17,positive
1i2gq1d,m7eybzp,m7ew8bh,2,0.1.0,comment,,You just made my day. Thank you!,larlar_17,1,,0,2025-01-16 15:12:32,https://reddit.com/r/philippineairlines/comments/1i2gq1d/carry_on_bag_size_away_luggage/m7eybzp/,/r/philippineairlines/comments/1i2gq1d/carry_on_bag_size_away_luggage/m7eybzp/,,,False,False,False,Philippine Airlines,You just made my day. Thank you!,2025-01-16 15:12:32,1,joy,0.9999999999999976,6.928108865538122e-28,0.9999999999999976,1.1840816821560454e-16,1.2375961205525984e-19,1.9854041146883901e-19,2.1229176368128598e-15,positive
1hzglz9,1hzglz9,,0,0,post,Confused about infant's baggage,"going to MNL from YYZ. I have an infant on a lap. I am confused as to if my infant gets a check in baggage because according to their website it says yes. But when I asked about it on PAL help chat, they said the infant has no baggage allowance because the infant's items will be on the mother's baggage allowance. Anyone have any experience with traveling with an infant on lap and what was your baggage situation like? thanks [https://www.philippineairlines.com/ph/en/before-you-fly/baggage-information/baggage-allowance/baggage-allowance-fees/infant-baggage.html](https://www.philippineairlines.com/ph/en/before-you-fly/baggage-information/baggage-allowance/baggage-allowance-fees/infant-baggage.html) edit: im not bringing a carseat/stroller so i mostly mean clothes in terms of baggage.",cooIcucumber,2,1.0,4,2025-01-12 14:24:43,https://www.reddit.com/r/philippineairlines/comments/1hzglz9/confused_about_infants_baggage/,/r/philippineairlines/comments/1hzglz9/confused_about_infants_baggage/,False,True,False,False,False,Philippine Airlines,"Confused about infant's baggage going to MNL from YYZ. I have an infant on a lap. I am confused as to if my infant gets a check in baggage because according to their website it says yes. But when I asked about it on PAL help chat, they said the infant has no baggage allowance because the infant's items will be on the mother's baggage allowance. Anyone have any experience with traveling with an infant on lap and what was your baggage situation like? thanks [https://www.philippineairlines.com/ph/en/before-you-fly/baggage-information/baggage-allowance/baggage-allowance-fees/infant-baggage.html](https://www.philippineairlines.com/ph/en/before-you-fly/baggage-information/baggage-allowance/baggage-allowance-fees/infant-baggage.html) edit: im not bringing a carseat/stroller so i mostly mean clothes in terms of baggage.",2025-01-12 14:24:43,4,fear,0.999998276049893,4.772238801649736e-08,1.7673229586041475e-08,5.0492555343092364e-08,1.608061929924127e-06,0.999998276049893,4.022113713620119e-15,negative
1hzglz9,m6r0keb,1hzglz9,1,0.0,comment,,We had our flight from YQR to MNL 2 weeks ago and back to YQR by the end of this month from MNL. We were able to bring 1 check in baggage for our infant and 1 collapsible stroller.,Kooky-Lavishness-953,1,,0,2025-01-12 22:47:17,https://reddit.com/r/philippineairlines/comments/1hzglz9/confused_about_infants_baggage/m6r0keb/,/r/philippineairlines/comments/1hzglz9/confused_about_infants_baggage/m6r0keb/,,,False,False,False,Philippine Airlines,We had our flight from YQR to MNL 2 weeks ago and back to YQR by the end of this month from MNL. We were able to bring 1 check in baggage for our infant and 1 collapsible stroller.,2025-01-12 22:47:17,1,joy,0.9676023683965681,5.658940291155041e-06,0.9676023683965681,0.0004995845047256732,1.921810416923379e-08,0.03189236236982796,6.570482911800025e-09,positive
1hzglz9,m6s6jci,1hzglz9,1,0.1,comment,,"Flew from YVR to MNL 2 months ago, my infant was allowed 1 checked-in baggage (car seat) then I gate- checked the stroller.",dmae16,1,,1,2025-01-13 02:21:01,https://reddit.com/r/philippineairlines/comments/1hzglz9/confused_about_infants_baggage/m6s6jci/,/r/philippineairlines/comments/1hzglz9/confused_about_infants_baggage/m6s6jci/,,,False,False,False,Philippine Airlines,"Flew from YVR to MNL 2 months ago, my infant was allowed 1 checked-in baggage (car seat) then I gate- checked the stroller.",2025-01-13 02:21:01,4,fear,0.5427974424709183,6.999339378778801e-06,0.45719307216049027,2.4611892898752733e-06,2.4815795488527344e-08,0.5427974424709183,2.4127396215512985e-11,negative
1hzglz9,mguw5b9,m6s6jci,2,0.1.0,comment,,Was the stroller free?.,martpeonies,1,,1,2025-03-09 22:42:00,https://reddit.com/r/philippineairlines/comments/1hzglz9/confused_about_infants_baggage/mguw5b9/,/r/philippineairlines/comments/1hzglz9/confused_about_infants_baggage/mguw5b9/,,,False,False,False,Philippine Airlines,Was the stroller free?.,2025-03-09 22:42:00,1,joy,0.9999998325236056,9.225471051136742e-09,0.9999998325236056,2.5054781917174308e-09,1.0329773156678135e-09,1.54664117931518e-07,4.8349727172993655e-11,positive
1hzglz9,mgv4al6,mguw5b9,3,0.1.0.0,comment,,Yes.,dmae16,1,,0,2025-03-09 23:27:23,https://reddit.com/r/philippineairlines/comments/1hzglz9/confused_about_infants_baggage/mgv4al6/,/r/philippineairlines/comments/1hzglz9/confused_about_infants_baggage/mgv4al6/,,,False,False,False,Philippine Airlines,Yes.,2025-03-09 23:27:23,1,joy,0.999860239172873,7.94228094662952e-05,0.999860239172873,2.60573793893194e-07,6.005721100138398e-05,2.020528569061896e-08,2.7579807429631928e-11,positive
