post_id,comment_id,parent_id,level,level_path,type,title,body,author,score,upvote_ratio,num_comments,created_utc,url,permalink,is_original_content,is_self,over_18,spoiler,stickied,dataset,combined_text,created_datetime,emotion_label,emotion_name,emotion_confidence,prob_sadness,prob_joy,prob_love,prob_anger,prob_fear,prob_surprise,sentiment
1o9kmdl,nm6esjk,1o9kmdl,1,0.1,comment,,Anyone here traveling with PAL,Even-Huckleberry4076,1,,0,2025-10-30 20:08:07,https://reddit.com/r/philippineairlines/comments/1o9kmdl/pal_gift_card/nm6esjk/,/r/philippineairlines/comments/1o9kmdl/pal_gift_card/nm6esjk/,,,False,False,False,Philippine Airlines,Anyone here traveling with PAL,2025-10-30 20:08:07,4,fear,0.644655776192085,0.00731336940321509,0.20402287389712348,0.002990056915166133,0.1410178690504038,0.644655776192085,5.4542006482633095e-08,negative
1o9kmdl,nm6ez73,1o9kmdl,1,0.2,comment,,"I have PAL ecard maintaining bal.20k,, selling with lower price...",Even-Huckleberry4076,1,,0,2025-10-30 20:09:18,https://reddit.com/r/philippineairlines/comments/1o9kmdl/pal_gift_card/nm6ez73/,/r/philippineairlines/comments/1o9kmdl/pal_gift_card/nm6ez73/,,,False,False,False,Philippine Airlines,"I have PAL ecard maintaining bal.20k,, selling with lower price...",2025-10-30 20:09:18,1,joy,0.9999591677642918,1.4708095643604215e-07,0.9999591677642918,4.3951575871826606e-11,4.0684870909998156e-05,1.2411816446789762e-10,1.1577222457168247e-10,positive
1o9kzyw,1o9kzyw,,0,0,post,2 first names but only one printed in passport,"hello! i just received my passport and planning to fly abroad (within asia) but i have 2 first names for example “John Paul” but they only printed “John” in my passport, will i have an issue flying abroad?",Cheap_Course_8490,1,1.0,5,2025-10-18 11:09:12,https://www.reddit.com/r/philippineairlines/comments/1o9kzyw/2_first_names_but_only_one_printed_in_passport/,/r/philippineairlines/comments/1o9kzyw/2_first_names_but_only_one_printed_in_passport/,False,True,False,False,False,Philippine Airlines,"2 first names but only one printed in passport hello! i just received my passport and planning to fly abroad (within asia) but i have 2 first names for example “John Paul” but they only printed “John” in my passport, will i have an issue flying abroad?",2025-10-18 11:09:12,1,joy,0.97494475253767,8.912786959956171e-05,0.97494475253767,1.118911803225996e-06,4.914861765617057e-07,0.024964499988094316,9.206656526636793e-09,positive
1o9kzyw,nk62h23,1o9kzyw,1,0.0,comment,,"Yes, may issue yan. Sa DFA mo kinuha? Diba pina paconfirn yan nila sayo kung tama yung details before irelease?",bialtertac,6,,0,2025-10-19 01:05:12,https://reddit.com/r/philippineairlines/comments/1o9kzyw/2_first_names_but_only_one_printed_in_passport/nk62h23/,/r/philippineairlines/comments/1o9kzyw/2_first_names_but_only_one_printed_in_passport/nk62h23/,,,False,False,False,Philippine Airlines,"Yes, may issue yan. Sa DFA mo kinuha? Diba pina paconfirn yan nila sayo kung tama yung details before irelease?",2025-10-19 01:05:12,1,joy,0.9989822242424943,0.0001023710491760664,0.9989822242424943,5.91482279443329e-09,0.0009153174386967684,8.135481021238217e-08,9.000390341788289e-17,positive
1o9kzyw,nk97m19,1o9kzyw,1,0.1,comment,,"2 first names sa nso birth cert? Ako tatlo first name sa baptismal cert pero isa lang sa birth cert, sa passport isa lang naka lagay. Basta pag nag book ka ticket indicate mo lang kung ano nasa passport.",enter2021,2,,0,2025-10-19 12:13:57,https://reddit.com/r/philippineairlines/comments/1o9kzyw/2_first_names_but_only_one_printed_in_passport/nk97m19/,/r/philippineairlines/comments/1o9kzyw/2_first_names_but_only_one_printed_in_passport/nk97m19/,,,False,False,False,Philippine Airlines,"2 first names sa nso birth cert? Ako tatlo first name sa baptismal cert pero isa lang sa birth cert, sa passport isa lang naka lagay. Basta pag nag book ka ticket indicate mo lang kung ano nasa passport.",2025-10-19 12:13:57,1,joy,0.627392585262033,0.00014923382567584697,0.627392585262033,0.0006420986252635654,0.34211905894605843,0.0296970219715637,1.369405553191022e-09,positive
1o9kzyw,nk9tsa8,1o9kzyw,1,0.2,comment,,Dapat kung ano yung nasa PSA birth certificate. Consistent dapat yung name na yun sa lahat ng ID’s mo.,Impressive-Mode-6173,2,,0,2025-10-19 15:34:28,https://reddit.com/r/philippineairlines/comments/1o9kzyw/2_first_names_but_only_one_printed_in_passport/nk9tsa8/,/r/philippineairlines/comments/1o9kzyw/2_first_names_but_only_one_printed_in_passport/nk9tsa8/,,,False,False,False,Philippine Airlines,Dapat kung ano yung nasa PSA birth certificate. Consistent dapat yung name na yun sa lahat ng ID’s mo.,2025-10-19 15:34:28,1,joy,0.6225920806206433,8.774069333157414e-06,0.6225920806206433,0.00010189086612309438,0.3772607458277714,3.650852420511153e-05,9.192383080960303e-11,positive
1o9kzyw,nk8ppca,1o9kzyw,1,0.3,comment,,Yes. Should be complete name khit gaano pa yan kahaba.,magicvivereblue9182,1,,0,2025-10-19 10:10:49,https://reddit.com/r/philippineairlines/comments/1o9kzyw/2_first_names_but_only_one_printed_in_passport/nk8ppca/,/r/philippineairlines/comments/1o9kzyw/2_first_names_but_only_one_printed_in_passport/nk8ppca/,,,False,False,False,Philippine Airlines,Yes. Should be complete name khit gaano pa yan kahaba.,2025-10-19 10:10:49,1,joy,0.9994992782855701,4.721550557125593e-07,0.9994992782855701,7.26534210692454e-08,0.00048674478218105577,1.3432064486046012e-05,5.928612103031786e-11,positive
1o9kzyw,nkjk6lr,1o9kzyw,1,0.4,comment,,"I assume that as long as you use only “John” for all travel — tickets, visa applications, etc., it should be ok.",shootpix4u,1,,0,2025-10-21 11:16:31,https://reddit.com/r/philippineairlines/comments/1o9kzyw/2_first_names_but_only_one_printed_in_passport/nkjk6lr/,/r/philippineairlines/comments/1o9kzyw/2_first_names_but_only_one_printed_in_passport/nkjk6lr/,,,False,False,False,Philippine Airlines,"I assume that as long as you use only “John” for all travel — tickets, visa applications, etc., it should be ok.",2025-10-21 11:16:31,1,joy,0.9999916617957924,3.2215217447004956e-14,0.9999916617957924,1.6154172017633994e-10,1.346266256499848e-13,8.338042499200686e-06,1.107349317136917e-17,positive
1o9i7gj,1o9i7gj,,0,0,post,Taxes and Fees for Mabuhay Miles Redemption,"First time to redeem miles for flights. Sa mga nakatry na, how much taxes and fees will it cost you for a round trip flight to Tokyo?",No-Sale-2728,0,0.5,4,2025-10-18 08:48:27,https://www.reddit.com/r/philippineairlines/comments/1o9i7gj/taxes_and_fees_for_mabuhay_miles_redemption/,/r/philippineairlines/comments/1o9i7gj/taxes_and_fees_for_mabuhay_miles_redemption/,False,True,False,False,False,Philippine Airlines,"Taxes and Fees for Mabuhay Miles Redemption First time to redeem miles for flights. Sa mga nakatry na, how much taxes and fees will it cost you for a round trip flight to Tokyo?",2025-10-18 08:48:27,1,joy,0.9959848422133893,5.634788770435173e-07,0.9959848422133893,9.984444489304525e-07,0.002124472024872052,0.0018891238383906734,2.197853572449594e-14,positive
1o9i7gj,nk7qd09,1o9i7gj,1,0.0,comment,,"Redeemed a roundtrip flight to Osaka last year and it was around 8k. It includes two pieces of luggage. And if ever you’re short by a couple of miles, you can always purchase. Btw it’s cheaper to book one roundtrip ticket vs two one way tickets (inbound/outbound)",Big_Yoghurt9976,2,,1,2025-10-19 06:31:09,https://reddit.com/r/philippineairlines/comments/1o9i7gj/taxes_and_fees_for_mabuhay_miles_redemption/nk7qd09/,/r/philippineairlines/comments/1o9i7gj/taxes_and_fees_for_mabuhay_miles_redemption/nk7qd09/,,,False,False,False,Philippine Airlines,"Redeemed a roundtrip flight to Osaka last year and it was around 8k. It includes two pieces of luggage. And if ever you’re short by a couple of miles, you can always purchase. Btw it’s cheaper to book one roundtrip ticket vs two one way tickets (inbound/outbound)",2025-10-19 06:31:09,1,joy,0.9925957535810616,1.1705515074523601e-08,0.9925957535810616,3.441623699298959e-05,0.007250505935018164,0.00011931154070731331,1.0007048394244832e-09,positive
1o9i7gj,nk7sc33,nk7qd09,2,0.0.0,comment,,"Interesting n 8K ang taxes and fees sa Osaka flights. I redeemed last year for Fukuoka and around 5K lang roundtrip. I recently redeemed din for Sydney and 8K naman. So it depends nga siguro sa destination. But one thing is for sure, kasama na ang travel tax sa babayaran. Lugi ka kapag minor yung ireredeem mo kasi full amount ang sisingili",Substantial-Figure97,1,,0,2025-10-19 06:43:11,https://reddit.com/r/philippineairlines/comments/1o9i7gj/taxes_and_fees_for_mabuhay_miles_redemption/nk7sc33/,/r/philippineairlines/comments/1o9i7gj/taxes_and_fees_for_mabuhay_miles_redemption/nk7sc33/,,,False,False,False,Philippine Airlines,"Interesting n 8K ang taxes and fees sa Osaka flights. I redeemed last year for Fukuoka and around 5K lang roundtrip. I recently redeemed din for Sydney and 8K naman. So it depends nga siguro sa destination. But one thing is for sure, kasama na ang travel tax sa babayaran. Lugi ka kapag minor yung ireredeem mo kasi full amount ang sisingili",2025-10-19 06:43:11,1,joy,0.9450064693198758,4.9271967251567567e-08,0.9450064693198758,6.211209025347809e-05,0.051407291937774754,0.0035240773109093478,6.921949257349095e-11,positive
1o9i7gj,nk7zf4f,1o9i7gj,1,0.1,comment,,"You can mock-book sa website nila. Just log in to your MM account, then click on ""Redeem using miles"" when booking a flight. Lalabas yung buong computation ng fees and taxes, ilang miles ang need, plus ano ang inclusions ng tickets such as baggage allowance and rebookable ba ang ticket etc.",Consistent-Hamster44,1,,0,2025-10-19 07:26:16,https://reddit.com/r/philippineairlines/comments/1o9i7gj/taxes_and_fees_for_mabuhay_miles_redemption/nk7zf4f/,/r/philippineairlines/comments/1o9i7gj/taxes_and_fees_for_mabuhay_miles_redemption/nk7zf4f/,,,False,False,False,Philippine Airlines,"You can mock-book sa website nila. Just log in to your MM account, then click on ""Redeem using miles"" when booking a flight. Lalabas yung buong computation ng fees and taxes, ilang miles ang need, plus ano ang inclusions ng tickets such as baggage allowance and rebookable ba ang ticket etc.",2025-10-19 07:26:16,1,joy,0.9819449123818953,5.301854123310775e-09,0.9819449123818953,1.5239628680380186e-05,0.00194432916319702,0.01609551352250924,1.8639050313448928e-12,positive
1o9i7gj,nnjwn5v,1o9i7gj,1,0.2,comment,,"Dati sulit, now not much. I just bought my tickets online and converted my miles to SMAC points instead See more info at https://www.reddit.com/r/AtinAtinLang/s/K2XOKy0S8x",decluttering-all,1,,0,2025-11-07 13:51:17,https://reddit.com/r/philippineairlines/comments/1o9i7gj/taxes_and_fees_for_mabuhay_miles_redemption/nnjwn5v/,/r/philippineairlines/comments/1o9i7gj/taxes_and_fees_for_mabuhay_miles_redemption/nnjwn5v/,,,False,False,False,Philippine Airlines,"Dati sulit, now not much. I just bought my tickets online and converted my miles to SMAC points instead See more info at https://www.reddit.com/r/AtinAtinLang/s/K2XOKy0S8x",2025-11-07 13:51:17,1,joy,0.9998992662563085,3.3259410112342686e-06,0.9998992662563085,3.192367607451299e-06,9.237911418446884e-05,1.8303094735801373e-06,6.011414845290649e-09,positive
1o8vyle,1o8vyle,,0,0,post,Question about Baggage,"Under ""Checked Baggage"", does the ""2 pieces up to 23 kg each"" mean two suit cases per person? If so, would that also exclude personal hand carry bags like sling bags and backpacks? Or does that mean 2 bags of any kind per person max? Thanks in advance.",Used_Telephone_5053,13,0.93,13,2025-10-17 16:39:50,https://i.redd.it/k02c2bohwmvf1.png,/r/philippineairlines/comments/1o8vyle/question_about_baggage/,False,False,False,False,False,Philippine Airlines,"Question about Baggage Under ""Checked Baggage"", does the ""2 pieces up to 23 kg each"" mean two suit cases per person? If so, would that also exclude personal hand carry bags like sling bags and backpacks? Or does that mean 2 bags of any kind per person max? Thanks in advance.",2025-10-17 16:39:50,1,joy,0.9810873254125131,0.00019915519815504528,0.9810873254125131,9.72696664882368e-08,5.0286752840953144e-05,0.018663134608461307,7.583631411995673e-10,positive
1o8vyle,njzdbsb,1o8vyle,1,0.0,comment,,You can check in two suitcases each weighing up to 23 kg on top of your 7kg handcarry + personal item.,iskamorena,3,,1,2025-10-17 22:57:24,https://reddit.com/r/philippineairlines/comments/1o8vyle/question_about_baggage/njzdbsb/,/r/philippineairlines/comments/1o8vyle/question_about_baggage/njzdbsb/,,,False,False,False,Philippine Airlines,You can check in two suitcases each weighing up to 23 kg on top of your 7kg handcarry + personal item.,2025-10-17 22:57:24,4,fear,0.6340383557661331,0.0009268755934605291,0.3545216886850295,1.2787645108805757e-07,0.010512937041050335,0.6340383557661331,1.5037875515295473e-08,negative
1o8vyle,nk0lbop,njzdbsb,2,0.0.0,comment,,"Yep, agree to this. To add: it's like 4 bags. I basically have 3 luggage + 1 backpack. Ung small luggage ginamit ko as handcarry and backpack as personal item.",ThrowRA_ColdSocks,1,,0,2025-10-18 02:36:12,https://reddit.com/r/philippineairlines/comments/1o8vyle/question_about_baggage/nk0lbop/,/r/philippineairlines/comments/1o8vyle/question_about_baggage/nk0lbop/,,,False,False,False,Philippine Airlines,"Yep, agree to this. To add: it's like 4 bags. I basically have 3 luggage + 1 backpack. Ung small luggage ginamit ko as handcarry and backpack as personal item.",2025-10-18 02:36:12,4,fear,0.9911721437507126,0.0006987056276877875,0.008127204143303883,7.492702588613274e-07,1.1968696771610234e-06,0.9911721437507126,3.3835970334798175e-10,negative
1o8vyle,nk1e4j8,1o8vyle,1,0.1,comment,,Yes excluding the carry on bags. I do this too. 2 medium checked in luggage then 1 backpack as personal item and 1 small luggage as carry on.,rrrowannn,1,,1,2025-10-18 05:05:33,https://reddit.com/r/philippineairlines/comments/1o8vyle/question_about_baggage/nk1e4j8/,/r/philippineairlines/comments/1o8vyle/question_about_baggage/nk1e4j8/,,,False,False,False,Philippine Airlines,Yes excluding the carry on bags. I do this too. 2 medium checked in luggage then 1 backpack as personal item and 1 small luggage as carry on.,2025-10-18 05:05:33,4,fear,0.9646362961670496,4.3906179039655044e-07,0.03536325409703652,7.816803674746907e-09,2.8560279409305824e-09,0.9646362961670496,1.2917502099335554e-12,negative
1o8vyle,nk1zuij,nk1e4j8,2,0.1.0,comment,,"Yes, tama to OP. Tried this too.",noveg07,1,,0,2025-10-18 07:12:33,https://reddit.com/r/philippineairlines/comments/1o8vyle/question_about_baggage/nk1zuij/,/r/philippineairlines/comments/1o8vyle/question_about_baggage/nk1zuij/,,,False,False,False,Philippine Airlines,"Yes, tama to OP. Tried this too.",2025-10-18 07:12:33,1,joy,0.9992169765877401,1.6019335237288877e-05,0.9992169765877401,9.250910580795705e-06,6.94737148174154e-07,7.393914909533475e-08,0.0007569844901447488,positive
1o8vyle,nk1zwzn,1o8vyle,1,0.2,comment,,"Just to add also, even if you only have one checked in luggage, do not exceed the 23kg limit per luggage (since you technically have 46kg allowance). I learned this the hard way in Narita for our NRT-MNL flight and I had to purchase an additional luggage. I’m not sure baka super strict lang din sila sa Japan, so I can’t say the same for other airports.",CommanderGreven,1,,2,2025-10-18 07:12:59,https://reddit.com/r/philippineairlines/comments/1o8vyle/question_about_baggage/nk1zwzn/,/r/philippineairlines/comments/1o8vyle/question_about_baggage/nk1zwzn/,,,False,False,False,Philippine Airlines,"Just to add also, even if you only have one checked in luggage, do not exceed the 23kg limit per luggage (since you technically have 46kg allowance). I learned this the hard way in Narita for our NRT-MNL flight and I had to purchase an additional luggage. I’m not sure baka super strict lang din sila sa Japan, so I can’t say the same for other airports.",2025-10-18 07:12:59,3,anger,0.7137546451365651,4.432519276794891e-05,0.28506709346536624,9.744585091156817e-06,0.7137546451365651,0.001124191617438505,2.77115156464813e-12,negative
1o8vyle,nk4xiq7,nk1zwzn,2,0.2.0,comment,,Hindi po ba pwede ilipat sa isang baggage yung excess dun sa 23kg? Para magbalance na lang sila,dhar3m,1,,1,2025-10-18 21:18:16,https://reddit.com/r/philippineairlines/comments/1o8vyle/question_about_baggage/nk4xiq7/,/r/philippineairlines/comments/1o8vyle/question_about_baggage/nk4xiq7/,,,False,False,False,Philippine Airlines,Hindi po ba pwede ilipat sa isang baggage yung excess dun sa 23kg? Para magbalance na lang sila,2025-10-18 21:18:16,1,joy,0.9209621601901801,0.014705220716043943,0.9209621601901801,1.8863873818541913e-05,0.00026169317893914076,0.0640520620410164,1.8001600069399763e-15,positive
1o8vyle,nk4xwxz,nk4xiq7,3,0.2.0.0,comment,,"Yes pwede naman, but I didn’t have another luggage kaya napilitan na bumili. 😅 Sinubukan ko lang talaga ilusot kung papayagan nila yung excess (which was 1kg lang).",CommanderGreven,1,,0,2025-10-18 21:20:44,https://reddit.com/r/philippineairlines/comments/1o8vyle/question_about_baggage/nk4xwxz/,/r/philippineairlines/comments/1o8vyle/question_about_baggage/nk4xwxz/,,,False,False,False,Philippine Airlines,"Yes pwede naman, but I didn’t have another luggage kaya napilitan na bumili. 😅 Sinubukan ko lang talaga ilusot kung papayagan nila yung excess (which was 1kg lang).",2025-10-18 21:20:44,1,joy,0.718993071667963,0.0010586744687725907,0.718993071667963,0.007738969089651606,0.260585226968698,0.011624055755537634,2.0493771111636206e-09,positive
1o8vyle,nketwjs,nk1zwzn,2,0.2.1,comment,,To add it’s for the safety of the baggage handlers. If the suit cases are too heavy they might have difficulty carrying it and get injured,sabreist,1,,0,2025-10-20 09:48:55,https://reddit.com/r/philippineairlines/comments/1o8vyle/question_about_baggage/nketwjs/,/r/philippineairlines/comments/1o8vyle/question_about_baggage/nketwjs/,,,False,False,False,Philippine Airlines,To add it’s for the safety of the baggage handlers. If the suit cases are too heavy they might have difficulty carrying it and get injured,2025-10-20 09:48:55,0,sadness,0.9999867649930759,0.9999867649930759,3.221398717312896e-06,8.760304788238229e-11,3.95358716920941e-13,1.0013515923783075e-05,4.284808632188577e-12,negative
1o8vyle,nk94sb0,1o8vyle,1,0.3,comment,,Nice! Someone is either going to Japan or the US. They're the only routes left with that baggage allowance. Enjoy,Wide-Net-9895,1,,0,2025-10-19 11:52:47,https://reddit.com/r/philippineairlines/comments/1o8vyle/question_about_baggage/nk94sb0/,/r/philippineairlines/comments/1o8vyle/question_about_baggage/nk94sb0/,,,False,False,False,Philippine Airlines,Nice! Someone is either going to Japan or the US. They're the only routes left with that baggage allowance. Enjoy,2025-10-19 11:52:47,1,joy,0.9999999963217221,2.6235637982181075e-12,0.9999999963217221,3.3903685356385883e-09,1.3426658023206744e-10,1.4563309077925243e-10,5.386151243970248e-12,positive
1o8vyle,nk9g2sz,1o8vyle,1,0.4,comment,,"2 pieces of 23 kgs each per luggage, 46 kgs total",SupermarketSure7354,1,,0,2025-10-19 13:23:56,https://reddit.com/r/philippineairlines/comments/1o8vyle/question_about_baggage/nk9g2sz/,/r/philippineairlines/comments/1o8vyle/question_about_baggage/nk9g2sz/,,,False,False,False,Philippine Airlines,"2 pieces of 23 kgs each per luggage, 46 kgs total",2025-10-19 13:23:56,4,fear,0.9161240133700947,0.00010863480992161718,0.08376648530629945,8.646631037032273e-07,8.451340844547876e-13,0.9161240133700947,1.849735383590495e-09,negative
1o8vyle,nk9yaqk,1o8vyle,1,0.5,comment,,"Yes, 2 suitcases per person weighing 23kg each. Excluded pa ang hand carry na 7kg and iba pa din ang sling bags and backpacks (personal item). Maraming nacoconfuse dito, isa na ko dun dati to the point na bumili pa ako ng extra baggage na napakamahal haha.",Sxsxarael,1,,0,2025-10-19 16:19:59,https://reddit.com/r/philippineairlines/comments/1o8vyle/question_about_baggage/nk9yaqk/,/r/philippineairlines/comments/1o8vyle/question_about_baggage/nk9yaqk/,,,False,False,False,Philippine Airlines,"Yes, 2 suitcases per person weighing 23kg each. Excluded pa ang hand carry na 7kg and iba pa din ang sling bags and backpacks (personal item). Maraming nacoconfuse dito, isa na ko dun dati to the point na bumili pa ako ng extra baggage na napakamahal haha.",2025-10-19 16:19:59,4,fear,0.9342579561501787,1.012395017714097e-05,0.06556290703164154,5.31804213945333e-06,0.00016369482428388825,0.9342579561501787,1.5792652249049258e-12,negative
1o8vyle,nka6e08,1o8vyle,1,0.6,comment,,"""Checked Baggage"" is for check-in only which does not include handcary, laptop bags and other personal belongings.",r0llers,1,,0,2025-10-19 17:43:09,https://reddit.com/r/philippineairlines/comments/1o8vyle/question_about_baggage/nka6e08/,/r/philippineairlines/comments/1o8vyle/question_about_baggage/nka6e08/,,,False,False,False,Philippine Airlines,"""Checked Baggage"" is for check-in only which does not include handcary, laptop bags and other personal belongings.",2025-10-19 17:43:09,4,fear,0.999991251218689,6.348938795885551e-07,7.991731076884832e-06,1.0920800802476602e-07,1.291868158307692e-08,0.999991251218689,2.966484290215018e-11,negative
1o8vyle,nkks822,1o8vyle,1,0.7,comment,,"2 suit cases per person weighing up to 23kg each, but better check what sizes are allowed. For Eva Air for example, they only allow 2 of the 68” (medium sized one). As for the carry on, you’re allowed the cabin sized luggage and a handbag or if you’re a guy a sling/ backpack. I haven’t flown with PAL in a while but double check which size check in for the 2pcs 23kg each it might be the 68” (medium sized check in), these airlines charge an arm and a leg for excess.",Evening_Gap4069,1,,0,2025-10-21 18:11:50,https://reddit.com/r/philippineairlines/comments/1o8vyle/question_about_baggage/nkks822/,/r/philippineairlines/comments/1o8vyle/question_about_baggage/nkks822/,,,False,False,False,Philippine Airlines,"2 suit cases per person weighing up to 23kg each, but better check what sizes are allowed. For Eva Air for example, they only allow 2 of the 68” (medium sized one). As for the carry on, you’re allowed the cabin sized luggage and a handbag or if you’re a guy a sling/ backpack. I haven’t flown with PAL in a while but double check which size check in for the 2pcs 23kg each it might be the 68” (medium sized check in), these airlines charge an arm and a leg for excess.",2025-10-21 18:11:50,1,joy,0.6422729574222726,3.298771516442873e-05,0.6422729574222726,2.4802139171569496e-05,0.0029829913717450236,0.35468625802443027,3.3272160191079726e-09,positive
1o8sfu4,1o8sfu4,,0,0,post,"NAIA t1 to t3, 3 hours enough?","I am flying from LAX through PAL, will arrive in MNL (naia t1) 6 am—- separately booked AirAsia (located naia T3) to Bangkok departing 9 am. Do you think it’s enough time? Travelling with my husband (I am US passport holder and he is PH passport holder) internationally for the first time. We’re scared we won’t make it on time. Thoughts?",FerretFit7344,6,0.88,22,2025-10-17 12:59:07,https://www.reddit.com/r/philippineairlines/comments/1o8sfu4/naia_t1_to_t3_3_hours_enough/,/r/philippineairlines/comments/1o8sfu4/naia_t1_to_t3_3_hours_enough/,False,True,False,False,False,Philippine Airlines,"NAIA t1 to t3, 3 hours enough? I am flying from LAX through PAL, will arrive in MNL (naia t1) 6 am—- separately booked AirAsia (located naia T3) to Bangkok departing 9 am. Do you think it’s enough time? Travelling with my husband (I am US passport holder and he is PH passport holder) internationally for the first time. We’re scared we won’t make it on time. Thoughts?",2025-10-17 12:59:07,4,fear,0.9999999988100177,4.172749794483669e-11,3.156190547819547e-10,2.1552991437102925e-10,6.171057684597606e-10,0.9999999988100177,2.6388890269668863e-17,negative
1o8sfu4,njzfu4j,1o8sfu4,1,0.0,comment,,"Just pray that your LAX-MNL flight won’t be delayed, T3 can be crazy in the morning. Inform a flight attendant that you’ll be catching another flight so that they can help you deplane.",iskamorena,2,,3,2025-10-17 23:09:48,https://reddit.com/r/philippineairlines/comments/1o8sfu4/naia_t1_to_t3_3_hours_enough/njzfu4j/,/r/philippineairlines/comments/1o8sfu4/naia_t1_to_t3_3_hours_enough/njzfu4j/,,,False,False,False,Philippine Airlines,"Just pray that your LAX-MNL flight won’t be delayed, T3 can be crazy in the morning. Inform a flight attendant that you’ll be catching another flight so that they can help you deplane.",2025-10-17 23:09:48,1,joy,0.963060553326391,1.1754856639594202e-06,0.963060553326391,1.6920593088486644e-07,0.034455357733074066,0.0024827442198291,2.9111532648998085e-11,positive
1o8sfu4,njzhi21,njzfu4j,2,0.0.0,comment,,This. LAX-MNL ang tricky part.,Sage_Trader,1,,0,2025-10-17 23:17:54,https://reddit.com/r/philippineairlines/comments/1o8sfu4/naia_t1_to_t3_3_hours_enough/njzhi21/,/r/philippineairlines/comments/1o8sfu4/naia_t1_to_t3_3_hours_enough/njzhi21/,,,False,False,False,Philippine Airlines,This. LAX-MNL ang tricky part.,2025-10-17 23:17:54,1,joy,0.9924318448511021,5.620828364619838e-06,0.9924318448511021,1.6124135351004514e-08,5.5865345434633413e-05,0.007506642794677728,1.0056285361493676e-08,positive
